instance_id,offensiveness,cleaned_text,cleaned_domain
8572,0,"george floyd’s brother breaks down about minneapolis video: ""you do not even do that to an animal"" #globalnews #newsmedia",blm
1768,0,george floyd's brother visits memorial at site of his death - abc news - via #blm,blm
4425,0,dopeaf,blm
2437,1,that bitch posted about blatantly breaking social distancing which is put in place to minimize catching covid and got mad someone she was with while she was actively not social distancing tested positive. you asked for it shorty nobody feels bad for you,covid-19
10134,1,this shit crazy.,blm
6079,0,another covid tragedy,covid-19
9689,0,"oh, really?",blm
1668,1,"shitt happened before as well, but for me #georgefloydprotests is a diversion.",blm
1720,0,seriously,elections2020
2871,1,sunday comics today. #trumpisunwell #blacklivesmatter #trumpresignnow #trumpout2020 #trumpslawandorderkills #racistinchief,blm
6667,0,lock the country up joey.,elections2020
1390,0,"you vote racists into office. #historyofthedemocratparty #youhavebeenfooled stop letting dems lie to get your vote. have not you learned by now they always turn their backs on you once elected? minneapolis: dem governor, dem mayor, dem council, and changed nothing.",blm
8651,0,"being a african american being lgbt :rainbow_flag: myself i run into lots a racism from other white lgbt males, and most lgtb hispanics try to act racist right along with them and they want to fight for inclusiveness and equality. what a complete and utter joke. #elections2020 #lgbt",elections2020
6845,0,is this coronavirus man made like the government tell us or is this a punishment from god punishing the world for their iniquities like it say in the bible and the government really do not have a cure?:man_shrugging_medium-dark_skin_tone:,covid-19
58,0,"who said rip is muslim abbreviation ... show me ??. itsy a general term use for all religion .... say "" he is allah , (who) is one """,blm
9386,1,you all got to start beatin these peoples ass,blm
2304,0,"o rapture, please come and get these people and leave us with godless science. #exvangelical",covid-19
300,0,"it took a week to get sick. how many people did that entire bar infect in that week? how many at her medical office? sure, you can say hindsight is a bitch. but, some of those they infected will not be afforded that luxury. get that through your heads!",covid-19
6935,0,"so when you are disarmed (no 2a) and you cannot call the good guys with guns (no cops), what is going to happen to you, your family and your home once criminals have free reign and no repercussions? infiltration, subversion. #wakeupamerica",blm
7709,0,this is almost unbelievable... almost... #elections2020 #voterfraud #riggedelection,elections2020
1708,0,"please make sure if you debate again to have amo against ivanka and jerrods connections with hotels and condos in saudi. she is marketing condos owned with gangster $$$. and, i am sure they have a lot more dirty dealings? does donny owe that $450m to the russian mob ?",elections2020
1549,1,what pelosi wants is negligent to our country. at this time we should not allow any foreigners into the country?until’ this coronavirus is under hand? she is crazy stupid for even thinking that?,covid-19
4689,0,"minks probably caught it from the workers. dogs/cats can catch it from people, but people cannot catch it from them. fur farms barbaric should all be banned. maybe time we stop screwing around with nature & animals.",covid-19
732,0,"yes. hi. if i had known what an absolute wanker the governor of fl was, i might have considered moving somewhere else. :skull_and_crossbones::upside-down_face:",covid-19
4627,0,while biden makes millions in china!!,elections2020
349,1,"in trumps own words. the only racist on the stage was you joe. antifa is not an ""idea"" joe.",elections2020
8269,0,bro must have been having the worst day imaginable lol he was like gta you gon have to kill me today. hope this king is doing okay,blm
4691,1,"you are lying, according to kameltoe harris 220 million americans have died from covid... surely she cannot be wrong",covid-19
5480,0,yes he did!! he was a tad angry too.,blm
72,0,kill coronavirus w kindness,covid-19
8066,0,death is not all covid-19,covid-19
513,1,yet advocate killing babies at 9 months gestation.,elections2020
7185,0,and a total farce for a quarter century long dictatorship to sermonize others on democracy...does not mean there was no crime or injustice on george floyd...,blm
7906,1,check with your news feed he was not guilty of a single charge of the hoax played out by your leftist lunatics,elections2020
7029,1,"bullshit , trump called the proud boys to arms and you know it.",elections2020
8326,1,that is why i voted #trump2020. you are a joke!,elections2020
7463,0,we shall be awash in the blood of hanks!,covid-19
5270,0,"george floyd death: boston celtics’ vincent poirier joins us protests with nba teammates marcus smart, enes kanter",blm
5655,1,the left are evil people,blm
740,0,grim prediction: covid-19 could be around ‘forever’ says leading uk scientist : via,covid-19
2276,0,"this is the ultimate test of""fool me once...""",covid-19
666,0,hackney stand up to racism and fascism vigil today outside hackney town hall #blacklivesmatter #nojusticenopeace,blm
9612,0,say his name!!!! #blacklivesmatter #blacklivesmatter:raised_fist_medium_skin_tone::raised_fist_medium-dark_skin_tone::raised_fist_dark_skin_tone:,blm
10330,0,lavena jackson was raped and murdered for her service. #anonymous #sayhername #blacklivesmatter #nojusticenopeace,blm
4431,0,because i love you,blm
1034,0,joe biden's campaign manager says the former vp will today end up with more votes than any presidential candidate in history. #elections2020,elections2020
1292,0,"if they plan to delay your biden bus again, the smart thing to do is deploy several buses and have biden in an unmarked vehicle so these bananas will stop the wrong bus. how low do you have to go to plan this kind of tactic? vote blue for a positive change!",elections2020
1153,0,. enough is enough! send in the military under the insurrection act and prosecute these criminal protesters! :backhand_index_pointing_down::backhand_index_pointing_down::backhand_index_pointing_down:,blm
3847,0,"""it is a democratic hoax.""...""15 cases today and will be down to zero next week."" trump* was either willfully lying or woefully wrong, either of which disqualifies him as a great crisis president.the pettiness is all his making. this is his legacy. #covid19 #covid #trumppandemic",covid-19
6557,1,speaking strictly as a uterus- your opinion is garbage. :face_blowing_a_kiss::thumbs_up_medium-light_skin_tone: #underhiseye :eye:,elections2020
8498,1,that is going to burn your ass when he does it in his second term. you would even vote against it.,elections2020
73,0,just say you are racist and go you literally have nothing more to say just over and over,elections2020
8150,0,"i regret each time i used to put my hand over my heart to sing this bullshit. now it is a knee or ""turn ts off bro""",blm
8713,1,i do not know bout you all... but i will beat the shit outta cop ion gaf bout no damn gun.,blm
1215,1,you want fascism? come to california for the holidays. #maga #californiafortrump,elections2020
9053,0,"""""stay at home"" seemed like sound public health advice – but it implies a notion of ""home"" confined to middle-class, mainly white neighbourhoods"" opinion: george floyd and the dangerously unequal effects of ‘stay at home’ orders",blm
453,1,"trump gets free airtime for campaign rallies most days he does those awful ""briefings"". needs to fight for equal time without the shitshow.",elections2020
5188,0,"wow! advertises tucson rally for days - about a dozen cars turn out -- across the state over 15,000 turn out to see president trump in bullhead, az after 4 day notice! via",elections2020
962,0,"ultimate panic irony: if a white ""long gun armed white supremacist"" opens fire at a peaceful george floyd protest, who are the protestors going to call, a social worker or a cop?",blm
5956,0,american media is beyond corrupt!,elections2020
267,0,alleged.... as if there is not a video of him murdering george floyd,blm
9718,0,i might be mad at him but i still love him:relieved_face:,blm
7071,1,they deadass just killed this 75 year old man.... you think he is going to survive serious brain trauma?? fucking disgusting.... why in the world would you shove an elderly man?,blm
7678,0,"#trumpsamerica sad 4 years of hatred and chaos. :United_States: 183,000 dead americans covid-19 #1 usa :United_States:",covid-19
1567,0,"how is that related to ""an anonymous mob gets to arbitrarily decide whether or not a person deserve to be harassed""",blm
1902,0,if ajith fans lived in united states they would have supported racist act and would opposed black #blacklivesmatter,blm
3243,0,do not talk down to people while you act like a coward. stand with your opinions. or hide. you are choice. but do not come into this community stirring the pot in favor of brutality and think you are all respectable behind an anonymous account.,blm
1950,0,"true, but the right is moving in the right direction thanks to trump. meanwhile the left becomes more and more corrupt.",elections2020
2056,1,you all niggas shoulda went to the cdc for giving us the run around about covid-19 instead of cnn,covid-19
7540,0,yikes. the oc is bout to be a mess with angry karens and kevins!,covid-19
9586,0,#georgefloyd is finally put to rest #georgefloydfuneral #georgefloydmemorial,blm
9526,1,"i will say it again with my whole chest-ozark, mo does not reflect the rest of mo!!! not all of us engage in this buffoonery :grimacing_face::grimacing_face:",covid-19
2559,1,you all voted for so you can sit on your fat ass and not work and collect hand outs,elections2020
7907,0,seriously?,elections2020
1402,0,joe biden at 248. finish him my boy,elections2020
10331,1,you put corona patients there to kill off the elderly to increase numbers to hurt the president everyone knows it your not fooling anyone,covid-19
8044,0,"opinion for the next six months, we are trapped on a leaking ship captained by a fool - the washington post",covid-19
9098,0,what? why????? this is so wrong,blm
5404,1,this is fucked up. you are going to arrest the black people trying to stop the looters?! get the fuck outta here,blm
4092,0,i see a lot of proud violent screaming leftists and liberals in black face passing racially motivated crime bills. you are not black. biden should be condemning his supporters.,elections2020
6335,1,she was not saying these things when she was obsessed with black guys :hot_beverage::frog:,blm
3510,0,panthers activate 2 offensive linemen from reserve/covid-19 list,covid-19
110,0,five democratic governors killed more people from covid than almost everyone else combined!,covid-19
9706,1,trump fanboys scared af right now :rolling_on_the_floor_laughing::loudly_crying_face: bozos,elections2020
2117,1,you are not black if you know where yo dad at,blm
8616,0,chauvin's previous victim said the name was right but the photos were not him... and he is not the guy on the news...,blm
8846,1,the hits just keep coming...what a turd.,blm
2104,0,"to be fair, everyone in the us had told trump to shut up at least once in the last four years.",elections2020
9862,1,corrupt joe will be impeached immediately if he is elected! america can not have a felon and an american traitor at the helm of our nation! give the dems back what they have dished out the last 4yrs! no peaceful transfer of power ever hate biden at all cost!,elections2020
963,0,"british prime minister boris johnson tests positive for covid-19, second global head of state infected with coronavirus #rtmagazine #covid19 #coronavirus #unitedkingdom #borisjohnson #globalhealth #infectiousdiseases",covid-19
203,1,"go to hell, pedo",elections2020
6004,1,?????????????? you guys seeing this shit,blm
7343,0,flynn pleaded guilty to his crimes even with a president that could pardon him. punish the arrogant sob already and move on. #trumpisanidiot #trumpistheworstpresidentever #trumpisnotadoctor #biden2020 #coronavirus #flynnexonerated #flynn,covid-19
140,1,"for some, white people do not matter understand that",blm
7065,0,a lot of deaths. no wonder you hate covid. but you say it is over. weird.,covid-19
4986,0,"out of respect for today’s memorial service for george floyd in minneapolis at 2 p.m. est, we will not hold a press briefing this afternoon. any updates for today will be released via press release and posted online at and",blm
4225,0,"dude, i freaking love you !!",elections2020
3928,0,"not same head, we have been lied to!",blm
2812,0,pa and mi - are you listening? get out and vote! our country depends on you #maga,elections2020
1815,0,"by refusing to hold trump accountable for his crimes, we are forcing a vote to remove him. elevating a shitty candidate to critical for survival.",elections2020
5891,0,"be skeptical of this article considering the source: you.s. workers without protective gear assisted coronavirus evacuees, hhs whistleblower says",covid-19
1409,0,trump supporter :face_with_rolling_eyes:,elections2020
1109,1,black twitter please take care of this as soon as possible. this white kid thought it was real cute to joke about h*nging black people. #goodbyescholarships #blacktwitter #blacklivesmatter #kpop,blm
7260,1,"#blacklivesmatter #hollowmessage #joke why does not his life matter? so many more, his just made a headline. you all are depraved.",blm
5015,1,you look feeble..:crying_face:,elections2020
1083,0,ayeeee the rust belt looking blue now huh?,elections2020
2212,1,"remember, the minneapolis murderpig was registered to vote in mn and fl.",blm
8946,1,"i do not believe nothing coming out of the mouth of these traitorous rat bastards! especially her, the biggest traitor of them all! nothing but a fascist!",covid-19
562,0,why did they even open in the first place?! get me out of america. we are all doomed here because no one is taking this seriously.,covid-19
365,1,"with being a bumbling clusterf—-, maybe we should chip in and get him a magic mouth via amazon prime...",elections2020
10715,0,people keep on saying trump has npd. i have lived with someone with clinical npd all my life so let me tell you why that is bullshit: nobody with clinical npd would be able to handle the position trump is in without completely breaking the fuck down. he is not a narcissist.,elections2020
10541,1,mutuals who follow her know what the fuck to do,blm
5030,0,source: mass (page 6): national (page 3):,covid-19
8878,0,story after story exposing far right media hating trump loving white supremacists inciting violence.,blm
2892,0,that is exactly what they are doing!! nobody said a word when this white man was killed just like george floyd!! the media harps on any and all chances to create and breed hate!,blm
3419,0,"chris wallace was pathetic. challenged trump more than biden. never pressed biden on packing the court. and, when it was ""open discussion"" for trump, per rules, wallace cut trump off. wallace covered for biden. but we all knew that would happen!",elections2020
4581,0,"""all of america bleeds blue"" bitch i bleed red i do not know what tf yo talkin bout:exclamation_question_mark: #blacklivesmatter #thatsnotmypresident",blm
10225,0,"""all lives matter"" is a mockery of the targeted discrimination of groups based on race, religion, and color. #blacklivesmatter #muslimlivesmatter #indigenouslivesmatter",blm
3503,0,"say what you will about them using deadly force, but for christ sakes the man was charging them with a knife and has a criminal record almost as bad as yours is, no need to make him a martyr",elections2020
3332,1,"since the republicans are ok with hundreds of thousands of trump induced covid deaths (will be 300,000 by dec), they need a new name. instead of the gop, they are now the gfu, go fuck yourself party, which goes nicely with gru (russian intelligence), their bff.",covid-19
5796,0,george floyd’s killer has been arrested. are they making everyone take down the video?,blm
10081,0,this should make you angry. enraged. #blacklivesmatter #defundthepolice,blm
1672,0,one man on stage last night could not denounce white supremacist even when directly asked to do so.,elections2020
3808,0,sick in the head?,covid-19
3533,1,"fix your wire, it is showing! pedophile!",elections2020
801,1,that is bad. but also wtf is this shit?,elections2020
9590,1,so fucking racist you are literally doing what you told him he should not do. using your status to influence a swath of people politically. you dirty dirty cunt. :middle_finger_dark_skin_tone::middle_finger_dark_skin_tone::middle_finger_dark_skin_tone:,elections2020
4937,1,i am not sure either of the men appeared presidential during the #debates2020 although was on the defensive from the thuggish behavior of trump’s nod to #whitesupremacists was terrifying . dark days ahead.,elections2020
2299,1,"not watching the debate because i have already chosen biden......no amount of trump bullshit will change my mind. it is a waste i am going to. so i am going to do my nails! i vote biden because on the 200,000+ covid deaths and soldiers who have bounties on their head because of trump!",covid-19
5670,0,part 3. #blacklivesmatter,blm
5391,1,"simple decision...herd immunity. open everything up, do not weaken our immune systems. everyone wearing masks means next years flu season is going to kill ten fold the amount that covid19 did. morons",covid-19
331,1,would had me all the way fucked up!!,blm
499,1,take your covid fear campaign and shove it up your ass. were done with your fear mongering. done with your lies. done with your corruption. done with your lip service. done with your racism. done with your political games. were voting period.,elections2020
7829,1,"obama presided over the best years the maine lobster trade ever had by far so trump is lying and also it is insane to talk about lobster when over 120,000 americans have died from covid and there is a national conversation about racism and breonna taylor’s murderers are unarrested.",covid-19
5487,0,"amazing stupidity! when the court case reveals there was a history between these guys possibly toxic - perhaps festering, we will know we razed america to the ground because two criminals clashed and one died! it is possible this was murder in a law enforcement officer’s clothing!",blm
6126,1,was unsteady ? really try talking over a rambling idiot,elections2020
10699,0,does he still not understand what happens to evil people????,covid-19
10305,0,americans are split on whether a vaccine will truly end the covid-19 crisis: poll by,covid-19
5983,0,reason #1 why i did not go back to work at jcp,covid-19
4960,0,yet another awful aspect of this virus.,covid-19
6091,0,"they killed people. anyways, they are going to die soon, why should they decide our future lmao.",elections2020
1699,0,collectively we are the dumbest species,covid-19
6129,0,"hope you wakin your ass up today and takin action, weather it is goin out to protest or makin donations!! this is where we come together and make a change!! #blacklivesmatter",blm
9625,0,#elections2020 be like: why you all want a comatose corps with pedophile tendencies for president? asking for a friend.,elections2020
7974,1,"interesting article. too bad 90% of the comments below are from trump bootlickers. man, his cult is so embarrassing. hey, if you think this pill is magic because trump said so...then go for it.",covid-19
6956,0,"buckle up and hunker down, folks.",covid-19
7975,0,both advocate for an #antilynchingbill because they know they each have a sealed federal indictment hanging over their heads for treason. what is the punishment for treason? #hanging #thesepeoplearestupid #wwg1wgaworldwide,blm
6411,0,decades ago the old guard was in control. there were protests back in the 60'&70's. they tried back then. it took the invention of social media and cell phones to get everyone involved. george floyd died right in front of the eyes of the world. did not bother trump much to see it.,blm
5799,1,everybody talks about these poor 200k dead souls and rising as well as the over 6 million infected by covid19. except for the president of the united states & his administration. only except to bullshit the public every now & then about a vaccine touting their personal success.,covid-19
4583,1,another day another loss for the nigger community.. how many niggers do we have to lose before finally waking up? how long must we endure injustice? we cannot let racists win this battle.. to protect our nigger babies and secure a future for them in this nation #blacklivesmatter,blm
1575,0,read this! 18 you.s. code 242 deprivation of rights under color of law,covid-19
10400,0,and i think we can thank susan collins for maine,elections2020
2771,0,the world is black the world is white three dog night lyrics below via #blacklivesmatter,blm
1581,1,"ripping it apart??? who wrote that one for ya, dumb ass?",blm
6761,0,"wake up people! yes trump is in your face, but biden’s are corrupt, will trade your freedom for save the family name",elections2020
4939,0,"joe biden is a hypocrite for attacking trump’s plan to replace obamacare when joe’s running on replacing obamacare with ""bidencare"". clearly joe knows obamacare is a failure except for pre-existing condition coverage. trump plans to keep pec coverage and lower prices! #votetrump",elections2020
2956,0,"he also said ""i condemn them all""! i guess biden was too busy lying to hear that! biden also had a wire sticking out of his suit!",elections2020
4739,0,"also, local artists painted the words black lives matter in enormous bright yellow letters on the street leading to the white house, a highly visible sign of the district of columbia’s embrace of a protest movement. #blm #blacklivesmatter",blm
2128,1,this man is a damn idiot smh,covid-19
9141,1,it took #kobe and his #daughter to die and #georgefloyd to die so you all can die over #coronavirus fuck protesting i will just go #vote take all the republicans out the house bet shit change,blm
5856,0,"let freedom ring ... let freedom of speech be heard... our presidents tweet that was squelched.this is his tweet that was censored... ""these thugs are dishonoring the memory of george floyd, and i will not let this happen. """,blm
1363,0,ohmygod this is insane,blm
3966,0,the enemy wants to normalize violence as a response. do you not remember who you are? no violence! black america - do not allow the enemy define you! you are too strong! snap out of it! #wakeupamerica #black_lives_matter we are #inthistogether #qanon #wwg1wga,blm
8121,0,"trump has done more to combat sex trafficking than any other administration. more arrests, more resources to help the victims. more to stop kids from being gang raped 20x per day. !",elections2020
1297,0,"in other words, he is saying go to war against #realamericans of which he is not.",blm
9672,1,a guy who gropes kids and sells his country when he is lucid enough to,elections2020
4133,0,happy halloween - crime family #bidencrimefamily,elections2020
136,0,""" why do not you double your hustle and make up to 10,000$ while staying at home to avoid covid 19 """"ask me how""""""",covid-19
3289,0,"so, the suppression of #hydroxychloroquine by fauci & the democrats to perpetuate covid deaths to hurt trump has not happened? this doctor stated on the record! ""i have treated over 350 patients with 100% success"" you can prove she is lying?",covid-19
7797,0,straight up hate crime :clapping_hands_medium_skin_tone: #blacklivesmatter,blm
8859,0,"you cannot see it. but it is there. we do not have the numbers ... period. biden has never been a progressive, so i am not sure why you are expecting him to embrace us now. but what he has done is take some baby steps toward us that we can leverage. it will help people hurting now.",elections2020
9752,1,"but everything in this world is conspiring against me: covid, distance learning with 2 kids, the election, the state of this country in general, people who tell me i am making the wrong choices, all my volunteer positions that need me to respond instantaneously. fuck all you all.",covid-19
4751,0,new post (protesting george floyd's death safely) has been published on -,blm
3644,0,:kissing_face::kissing_face: but nevermind,blm
9229,1,"here ya go, all you #maga2020 's . knock yourselves out. go to church. just wear your red hats so we all know to stay away from you.",covid-19
5269,0,#voteagainsttrump #msnbc why cannot people see the republicans are the party of old money and old ideas. they also like to tell people how to live but do not want us to tell them how live. hypocrisy!!!,elections2020
9505,1,spot on. why is that? i will not be kneeling for any bastard,blm
4102,1,you sat in your basement bunker so stfu about who sat in a bunker. hiden biden!,elections2020
8883,1,47 years of nothing....sold out america...you cannot do anything.... you are a puppet of china......virus -virus-virus.......this old timer:backhand_index_pointing_down::backhand_index_pointing_down::backhand_index_pointing_down::backhand_index_pointing_down:tells it like it is....:oncoming_fist::hundred_points::backhand_index_pointing_down::backhand_index_pointing_down::backhand_index_pointing_down::backhand_index_pointing_down::backhand_index_pointing_down::backhand_index_pointing_down:,elections2020
4066,0,am i supposed to feel sympathy?? ignorance is a choice,covid-19
3968,0,"this is called ""hedging your bet"".",covid-19
10484,0,covid 19 to protect the innocent. trump will get himself killed soon enough. :crossed_fingers_light_skin_tone:,covid-19
2407,0,"why were you wearing a wire? #bidenwired #bidenwiredup you will deny it. just like you say everything else is a lie. saying something is a lie does not mean shit if you cannot back it up. your 2020 platform: ""everything is a lie.""",elections2020
