instance_id,offensiveness,cleaned_text,cleaned_domain
2350,0,"if you do not see why every presidential candidate & every voter should denounce white supremacists, by default, you support white supremacists",elections2020
5565,1,trump did not have a covid19 plan to try and minimize the virus. it is crazy how you and anyone that has blinders on that this is a real issue. being stuck on stupid is not going to get the usa back on track.,covid-19
8049,0,"yes? when biden was asked do you condemn antifa? you know what he said? ""antifa is an idea not an organization"". you have got to be kidding me. if trump had said white supremacy was an idea and there were no white supremist organizations wallace would have demanded clarification.",elections2020
9093,0,i am not saying it his killing is justifiable at all...i am saying it would not have ended like this if rayshard would have just not fight back and use the taser. people needa stop comparing this to george floyd and breonna taylor,blm
2930,0,you will lose. evil always loses in the end,elections2020
10589,0,why coronavirus is killing african-americans more than others,covid-19
7663,0,this is crazy #blacklivesmatter#tiktok,blm
7039,0,"i understand it just fine. i am a front line medical worker. i have actually been on the field while you just parrot talking points. seen a lot more overdoses, abuse situations and suicide attempts since this started than i have covid-19. quit being a sheep.",covid-19
6415,0,"i feel like this covid-19 hoax could be true. but what i find hard to believe is that a sociopathic narcissist would admit to a fake illness of this magnitude. and, the 10 top-notch doctors who actually have ethical standards would not go along with a political farce like that.",covid-19
9816,0,"waiting on you,",covid-19
9868,1,"joe biden threatened brazil for sanctions, because it will be sanctioned in california! ta crazy joe agent of shitty biden, his mother never taught him that i never threatened parents with honor!",elections2020
10590,1,i thought the gop’s racism got a damn bad cold during nixon and it got nothing but worse from then on. it is just now that it became exalted under trump.,covid-19
8280,0,am i stupid or is this just because of population growth and high turnout??,elections2020
1374,0,why would anyone even vote for trump ever #elections2020,elections2020
9417,0,"projection, projection, projection. :grinning_face_with_sweat: honestly, if it was not so serious, this guy would be hilarious. :person_facepalming::person_shrugging::face_with_tears_of_joy: #trumphatesamerica #trumphateswomen #trumphatesourmilitary #trumplies #trumpisnotwell #trumpmeltdown #votehimout2020",elections2020
7537,0,"""his feelings at the end are so true. stop falsely correlating the two parties. stop normalizing bad behavior by saying """"well the other guy does this"""". start calling these pieces of shit out. do. something.""",covid-19
4925,0,you are a busted flush ..politically prejudiced,blm
10696,0,donald trump claims he will take back seattle from 'ugly anarchists' protesting george floyd killing if 'not stopped',blm
8800,1,"he also pisses his pants, should we do that too so we do not get covid in bathrooms?",covid-19
3728,0,"""a california man charged in an $8.5 million covid-19-relief fraud scheme took """"hundreds of thousands of dollars"""" and spent it at las vegas casinos, according to a release from the justice department.",covid-19
10190,0,facebook employees criticize company position on trump's george floyd posts #fortune500,blm
1405,1,we got our little asses out there and mailed in our ballots like good little kids. of course more people showed up in their trucks. that is what he told them to do.,elections2020
4634,1,"please, pull your head out of your ass and look around you and realize what is at stake here. do not let up. at all. going high only gets you stabbed in the gut, dummy. try learning from recent history, you geriatric asshat. #voteblue2020 #joebidenkamalaharris2020",covid-19
9834,0,i guess these idiots will have to learn the hard way. google news - cyclist who charged youth putting up george floyd protest flyers arrested,blm
7451,1,trump is a maniac. sweden already tried herd immunity on covid and it failed! he wants to duct tape fauci & cdc to help his re-election? how many are to die in your attempt to cheat out a win?,covid-19
6776,0,my only thought is to get the openly racist potus out of office. that is my only concern.,elections2020
10003,1,"""a group of young white men"" you mean thugs? animals? call them what you all call us!!",blm
6939,0,"nothing will be done to these people! if they were in other cojntries, they would be with george floyd! disgusting! the officer that murdered george floyd should die the exact same way!",blm
5634,0,anonymous is so hot :hot_face:,blm
4593,0,nixon: am i a joke to you?,elections2020
8033,0,i doubt it and that is a travesty :angry_face:,blm
5439,1,you dumb mf. you are a traitor.,elections2020
4433,0,:angry_face:has trump achieved a fascist authoritarian government? :angry_face: ‘this is the coverup’: cdc website stops reporting number of covid-19 virus tests :angry_face::angry_face::angry_face::angry_face::angry_face::angry_face::angry_face::angry_face: #trumpvirus #moronavirus #coronavirus #covid19 #covid_19,covid-19
1777,1,nobody needs these losers' 'help',blm
4863,1,covid cock blocked you,covid-19
7238,0,reminder #covidー19 #covid19sverige do not forget the green box! :) #corona,covid-19
6157,1,we are tired of black people making shit up!!,blm
5730,0,"and they were able to wear masks everywhere else too. the reason why i hate this hypocrisy is because people will whine about ""a second wave of covid"" and it will be all from the selective enforcement. just a matter of time before you see twitter crying about that. stay safe bro!",covid-19
3473,0,"it is rather extraordinary to see this, but it seems like shaming a major institution (even a twitterstorm) might actually work sometimes.",covid-19
6039,0,keep the faith ! we trust in you !,elections2020
5027,1,"thread by trump is a warrior and you are a weak liar, man. you would have punched him if you could have right?why will not you answer the questions chris asked you?why did you lie...…",elections2020
1228,1,boom. #bidenharris2020 #traitortrump #veteransagainsttrump #trumphatesourmilitary #covid19 #fridaymotivation,covid-19
2910,1,"age does not even matter either. if citizens intervened, they would get the shit kicked out of them by the police while the same awful outcome for george floyd.",blm
3727,0,"#donaldtrump has been obviously inspired by his brutal friends around the world. exactly same reactions, accusations, conspiracy theories. how proud they must be of him now, especially his ""favourite dictator"" #elsisi :clapping_hands: #black_lives_matter #georgefloydprotests",blm
8610,1,"scared little #bunkerboy lives in the big house painted in white he is scared the big bad wolf is coming to get him at night, so, he built a biggie fence to keep all the big bad ass citizens away he hides in his #bunker day & night, waiting for them to go away #blacklivesmatter",blm
10560,0,who killed george floyd by kneeling on his neck? who shot breonna taylor 8 times to death when she was lying in her bed and not doing anything to resist anybody?,blm
8402,0,i had this sick thought that what if the owners of all the old music venues in chicago are forced to sell post covid and they all turn into condos...hold me...,covid-19
8175,1,disgusting!!!!!!! who the hell is this? we got to find this shit head and put his ass in jail. how tf you going to touch someone kids. white people like this make me sick.,blm
8877,0,what if everyone used black at pride this year? #blakelivesmatter #pride #lgbtq #blacklivesmatter,blm
9398,0,"i talk to many gopers. on the issue of politics, they come armed with an array of gop driven spin and propaganda from fox/conservative media. this has been the case since the 80s/90s. you have to break the cycle of propaganda if dems are going to win white voters again.",elections2020
927,0,"racism is real, and democrat presidential candidate owns it. why do democrats never want to own their issues and all they ever do is point fingers? joe...there are three fingers pointing back at you. when will you apologize for your racism and come clean?",elections2020
1781,0,why is his mouth grinding side to side? some kind of drug side effect?,elections2020
8860,0,mo brooks calling george floyd a druggie and a thug is not the least bit surprising. but you should call him at (202) 225-4801 and tell him what you think about him.,blm
7060,1,love sucking off married men at the malls while the wife and kids shop :smiling_face_with_horns:,blm
6033,1,"""let me know when baron trump sits in a loaded classroom..... until then, you can kiss your own ass! gop senator says they """"can kiss my a**"""" as teachers, unions oppose school reopenings over covid concerns",covid-19
3172,0,"shut up mr dump was blatantly racist and inciting problems if that is something and someone you want to support that is up to you, but you will be remembered in history just as bad as mr dump will be...do not worry about that your grandkids will not be remembering you with fondness!",elections2020
7216,1,fucken #deplorables .... #stayhome,covid-19
4567,0,for those who coward behind the democratic line will reap what you sow. a vote for is a vote for for president. joe is not making it more than 15 months into his presidency. democrats did not want him but were stuck.they will put forth that he is not fit.,elections2020
10476,0,"simple solution to this. do not pass out drunk in your car in a drive thru, resist arrest, assault police officers, then attempt to use a stolen weapon on them. george floyd murder? yeah, unjustified and the cop should rot in jail. this? not the same thing.",blm
307,1,"dear people celebrating #walangpasok bec. of the covid-19, fuck you. bobo ba kayo?",covid-19
7954,0,so disgusted dawg,covid-19
1404,0,this maniac has exactly zero grasp of reality.,blm
10325,0,china's motor mouth spokesperson 'mohammad' lijian zhao ( who had to drop the mohammad to keep ccp happy) is the same one who said us army brought #coronavirus to china and now making new claims on indian territory and #lac #india should ignore his rants and stay focused,covid-19
4120,0,"my brother also died may 25th of.he died alone not 1 visitor allowed in and we had to wait until june 3rd for the funeral, in which only 20 people were allowed to attend. to say i am pissed off does not even begin to describe how i feel! nobody cares about him!!",blm
10332,0,"anyway, an early good night because tomorrow is going to be a long ass-day #blackautisticlivesmatter #blacktranslivesmatter #blackdisabledlivesmatter #blacklivesmatter",blm
10265,1,probably bitch-ass,elections2020
3393,0,that is all it takes to impress you? a pig putting his hand up? cops been kneeling and smiling with folks all week then turn right around and beat the shit out of protesters. demand more.,blm
1188,0,this mp is inciting criminal damage,blm
5048,0,not a women being a trump support,elections2020
862,1,"bye bye gop, you had really a shitty run:waving_hand::grinning_face_with_big_eyes:",covid-19
7305,1,telling? as in black lives may actually be saved? as in black people may finally be equal? f$ck racist piece of :pile_of_poo:gop. you are not the party of lincoln. go read your history!,blm
9230,1,happy #obamaday! question for you...is it still hard to deal with being inferior at the job? or have you gotten used to that by now? #obamaday #trumpsucks #mushroomdick #littleman #blacklivesmatter,blm
2577,0,"""the green new deal is not my plan."" ""i did not say that,"" says about the clip we all saw in the last week.",elections2020
9277,1,the sad thing is a guy died due to blatant police brutality and pretty much everyone was in agreement. then some shitheads with unrelated political and/or criminal motivations turned a local protest into nationwide riots. #georgefloyd,blm
3469,0,ยังกะ the walking dead #ไวรัสโคโรน่า,covid-19
6915,0,biden's in a tough spot. he knows he is a criminal and he knows trump is holding all the cards and knows what he is done. he is fighting for his life and the life of his criminal son. he is a 47 year swamp creature and he knows his days are numbered.,elections2020
2496,0,"yup! and this is exactly why us resisters need to continue to be diligent in reporting these racist americans who have no place in our country! they can take their ""king"" in the wh and leave for say, russia, after we boot him out later this year!!",blm
3776,0,please sue him into oblivion!,elections2020
8500,0,"irony is in ww i over 2 yrs we lost 116,253, 63,000 of them died from spanish flu virus :microbe: in 2 months 24 days we are reaching 100,000 covid virus :microbe: alone. ""facts matter""",covid-19
1338,0,"as we watch some of the appalling coverage by mainstream, ie white media, on the murder of george floyd and the resulting uprising against police brutality in amerikkka we need to remember why this media coverage is…",blm
7739,0,"there were hundreds of #maga why did not they step up. calling out some illegal militia to kill other americans while you are on the couch, brave james, real brave.",elections2020
2918,0,the same who released a statement arguing for kids to go back to school. the hipocrisy.,covid-19
2900,1,close your legs and act like a decent human being kayleigh,elections2020
7675,0,this guy needs to answer for his behavior.,blm
5904,0,covid-19 remember the job you took. you failed miserably! :backhand_index_pointing_down:,elections2020
8630,0,"this innocent blood will be on all your hands. the wrath will fall on this nation and world undiluted and you my people will have angered me by remaining silent. beware i am not only a god of love, but i am a god of mighty wrath when angered.",elections2020
10705,0,and what does that tell us about the modern gop mind? #tyranny #sociopath #enemyofthestate,blm
7775,1,bullshit.,elections2020
6243,0,serious question... have more people come out for blm protests then showed up for trumps inauguration? #blacklivesmatter #trumpdictatorship,blm
8453,0,"not at all. leftwingnuts are as bad as rightwingnuts. the cdc lists 36 children under 15 dead from covid-19. your rightwingnut federalist said only 12. see what i mean? go to the actual source, not some political interpretation, from either side.",covid-19
7105,0,the media is responsible for this stupidity. i watched briefing and what he said was so minor & obvious i never gave it a second thought until the media pushed something that was not said.,covid-19
9588,1,yeah the whole george floyd discount comment was fucked,blm
7361,1,"krugman defends lockdowns, which have already eliminated over *1.4 m health care jobs*, under the asinine pretext of supposedly *protecting hospitals*. this *is* an *epic fail*, and krugman helped to create it. #hypocrisy #mendacity",covid-19
768,0,all those trump supporters who froze their asses off in omaha should know by now that you cannot get cold if you do not have thermometers. it is just #maga science. #omahastranded,elections2020
3809,0,#cuomo scared trump and made him walk back his king talk #pressbriefing #covid19 #trumpliespeopledie #trumpsnotaking,covid-19
6660,0,"hi silicon valley twitter, as part of palo alto chapter, i am working to help raise some more funds so more families can pay their rents during covid. if the idea of keeping families sheltered during the pandemic appeals to you, please join me :)",covid-19
1484,1,truly the dumbest people run our country right now,covid-19
1866,0,they used guns:fearful_face::fearful_face:,covid-19
6387,0,welcome to socialism,blm
4913,0,i bet it is going to start up again at some point tonight or tomorrow,elections2020
7215,0,"in addition to the covid-19 stats on usa vs sweden!! something that will make you rethink how many deaths the virus has taken in usa is about 131,000 which is alot but in 2020 cancer deaths in usa about 606,000 deaths & heart disease 800,000!",covid-19
7573,0,:white_heart::white_heart::white_heart: love you lidzzzz,blm
1494,0,hi and this account has racist and xenophobes tweets using false information to discriminate people. we hope you can resolve this and suspend the account as soon as possible. thank you,covid-19
9311,1,"appearing to claim america’s cities have been besieged by ""right-wing extremists’ instead of antifa and blm? defending crt? repeating the charlottesville lie? refusing to ask biden if he disavowed antifa? wallace phrased every question to attack trump and protect biden.",elections2020
4496,0,and you refuse to admit that antifa is a terrorist organization. it is just an idea :woman_facepalming:,elections2020
6319,0,"love to see a list of 20,000 lies.just think about how ignorant your comment is. please link me that list. thanks.",elections2020
2316,0,those 20 seconds of silence! #canada #trumpdictatorship #trumpincitesviolence,blm
9645,1,"do not worry, now that the #bubolinski interview is out, your name is being smeared along with #crookedjoebiden, just like your vagina was to get you where you are now.",elections2020
8700,0,"please worry about covid, russia, and supporting black lives now. not your polling numbers. you do not display the priorities of a true be a president and stop pandering to your base.",covid-19
9404,0,but are those not pants? how do fart molecules correlate to covid molecules?,covid-19
5884,0,what?!?!!?,blm
3515,1,"see stuff like this make me mad because why should white people get more justice in america when us black people the one who made america! i say burn all them white buisness down ! , they did not work for they stuff we did !",blm
10535,1,"obama always go for bad eggs because of his hidden agender of the church of satan and the gay community. do whatever you want, except god is asleep to let off the way, will still not win",elections2020
2941,1,^dumb brit involving herself in us politics and showing her iq is very low,elections2020
2509,1,"nice try, loser! jemele hill mocks pence appointment to head coronavirus response",covid-19
5304,0,"uh huh:smirking_face: this^^^coming from the person who is dripping with hate. i swear, the left is everything they claim others to be.",elections2020
3550,1,you will go down in history as the most corrupt crime family in the world!! drop out and hang your head in shame!!,elections2020
3747,0,"you mentioned getting together with law enforcement last night, to work things out. one issue i see with this is that white supremacists have infiltrated our leo agencies. will your reform include investigating these officers and expelling those with ties to...",elections2020
3190,0,"flu statistics for the 2019-2020 season (cdc stats) are far worse that cov-19 despite the fact we have vaccinations and antivirals for the flu. cases: 38,000,000 hospitalizations: 390,000 deaths: 23,000 pediatric deaths: 149. why are we destroying our country over covid19?",covid-19
10729,1,fuckin disgusted,blm
9308,0,i am so mad at corpus christi. you all do not deserve whataburger and selena.,elections2020
401,1,this is not big. this is not funny. this is not acceptable. prime example of people using this just to cause trouble. idiots man!,blm
1257,1,you have been a crime family for 30 years! you have the character of a mob boss! bye bye joe...,elections2020
7770,0,"seriously?!?! the amount of disrespect for human lives the ""president"" shows is unimaginable",covid-19
2401,0,it could have just been 4 cops but 9000 people seems like a better way to go :face_with_rolling_eyes:,blm
8757,0,i would tread very lightly if i were you :eyes: #blacklivesmatter #justiceforgeorgefloyd #protests2020 #riots2020 #covid19 #enoughisenough #racistinchief #pedophile #fakepresident,covid-19
4241,1,"what a joke, trump speaks for the first time in days and says nothing but the recycled shit that he is been spewing for months. mentioned george floyd once saying it was a great day for george, how is that, george is dead, there will be no more great days for",blm
2434,1,"nonsense. americans should start solving their own problems. we have had enough with trump and racists in the us, tearing our country apart. when george floyd was killed by a racist police officer, the simmering anger burst. that is why we took to the streets.",blm
2328,1,lying criminal pedophile,elections2020
4126,1,"""for those too young to remember the iraq war and 2008 economic meltdown, """"liberals are rooting for us to fail!"""" was a frequent coping mechanism for ridiculous conservatives as their relentless incompetence was exposed. #trumpvirus #coronavirus""",covid-19
9401,0,this is just so sad in so many ways.,blm
4570,0,"senators blast trump administration for coronavirus response top officials in the trump administration struggled on tuesday morning to justify their response to the growing threat of the coronavirus, which has sickened at least 80,423 people arou... #usrc",covid-19
2258,0,so did they beat him up?,blm
196,0,bbc news - george floyd death: minneapolis to host first memorial event,blm
6619,0,this is bad. #gopbetrayedamerica #trumpviruscoverup #trumpownseverydeath,covid-19
5528,0,he is fighting for his wife’s cushy job the old fool and coward who is just making things up! #registertovote #votegopout #blacklivesmatter,blm
7860,0,yea i would imagine season 4 will be out end of this year or sometime 2021 given covid,covid-19
596,0,"because guess what, you cannot blame trump for everything wrong in the world. surprise, surprise",covid-19
1087,0,"it is that black and white, we have led the world in covid cases per 100,000 and deaths per 100,000 since april...and it is now peaking... that is the horrific part...it is peaking now! after months of leading the world.",covid-19
7201,0,who trump,elections2020
7760,0,i love the hypocrisy how you preach jesus then talk about this being fake? nice. #blacklivesmatter,blm
1569,0,it was a great example!,elections2020
2971,0,#malikkingbell message to the youth link in my bio #georgefloyd #breonnataylor #mymessage #sacramento #sacproud #blm #blacklivesmatter #art #music #tiktok california,blm
2518,0,i would give him a #mylarblanket and a microwaved frozen burrito...but that is it. #stephenmillerhascovid #reptilesgetcovid,covid-19
5794,0,thank god i do not live where idiots are on charge!,blm
6446,0,not a lie friends and fam. i watch protests from protesters not the news on tv. cnn pulled out close to midnight. twitter live feeds went dark around 2:30 am. snapchat is also scrubbed. this did not occur on other nights. i saw lots of people still peacefully protesting at 12.,blm
9090,0,oh you spittin right now,blm
7561,1,"you know what this right here is, ? :backhand_index_pointing_down::backhand_index_pointing_down: bullshit :hundred_points: bullshit, do not get excited :folded_hands::United_States::red_heart:",covid-19
825,0,she real smart. and hypocritical.,covid-19
2740,1,the most insensitive pos ever!,blm
7892,1,is lying. he is doing this because he does not want to get fired like trish reagan did.,covid-19
6314,0,how do we fix the system so incidents such as george floyd never happen again ?,blm
10585,1,what did have to say when he was asked to condemn antifa? oh wait. no one asked him. antifa is real joe. #demsaredestroyingamerica,elections2020
2796,1,no kidding. i was thinking the same thing. donald's entire strategy was to rattle joe. what an asshat,elections2020
4415,0,jfc prosecute and defund these racist bullies.,blm
5890,0,here is one practical strategy towards dismantling systemic racism: start firing racists at the drop of a hat. #blacklivesmatter #tuesdaythoughts,blm
9370,0,because houston is not a place that suffers fools or foolishness well. good on them.,blm
6771,0,"her apology is empty. she is not sorry, she is embarrassed she got caught. it is all on her, she knew she was being filmed-how arrogant she is & her husband as well. did she really think nothing would come of it - today? after george floyd? enough is enough. too bad felicia.",blm
7614,0,this terrible #mexico :Mexico:,covid-19
5603,0,honoring our naaman football seniors. congratulations #onelink #blacklivesmatter #gisdalwaysconnected,blm
9333,0,this is utter bedlam. we have lost all perspective #londonriots #blacklivesmatter,blm
2588,0,republicans close barn door after horses escaped. #republicansarekillingus,covid-19
8257,0,you not only share brexit together but also the embodiment of institutional racism in the uk,blm
2490,0,only in administration is so full of hubris he actually thinks/believes the #coronavirus that is paralyzed the #globe w #death & #destruction will bend to his liking - beyond pathetic. #test #trace #isolate b/4 we start to #openamerica where are the tests?,covid-19
4198,1,this guy is a troll,elections2020
190,0,sickest i have ever been in early november. literally thought i was going to die.,covid-19
749,0,klassy karen. resorting to insults.,elections2020
8293,0,only because of what joe said,elections2020
5536,1,ffs shut up,covid-19
9640,1,that or you are ignorant and hateful,elections2020
2953,1,"it is far bigger than any truly imagine. you all are involved in human trafficking, corruption, mk ultra, spirit cooking, cannibalism #laptopfromhell",elections2020
991,1,"#trump won without doubt. now #corruptmedia #corruptjoebiden & #corruptdemocrats r scrambling 2 fix results. disgusting! if #sleepyjoe was truly winning, they never would have holted counting votes. they would have proudly announced their win. but not the case. #election2020 #maga",elections2020
6665,0,"economy, energy, foreign policy, ending stupid wars, prison reform, law and order!",elections2020
