instance_id,offensiveness,cleaned_text,cleaned_domain
9923,1,anyway is basically as much a murderer as trump,covid-19
8351,1,"i do not live in kentucky, but that smug a-hole pissed me off too. i pray you all kick his smug ass out, & elect a senator who actually thinks she has to work for and answer to kentuckians.",covid-19
4709,0,never underestimate the stupidity of half the american public...,elections2020
4934,1,it is pathetic. #bidencrimefamilyexposed,elections2020
3567,1,disgusting animals #scum,blm
6580,0,it is not about you think anyone frank because if your experience has this country with traitors running this country and is in our white house just stop and sit this one out #blacklivesmatter,blm
2521,0,fbi: hackers are targeting us hospitals with ransomware attacks as coronavirus admissions surge – vox,covid-19
4358,0,"floyd’s family should sue for $1million. eye for an eye! we should have had #policereform and avoid racist like that to ""protect and serve"" ... or should i say murder. it is enough, we need change! #blacklivesmattters",blm
3971,1,blacks and browns saw this a$$hole not condemn racism. this is who.he is.and how he feels,elections2020
2883,0,it is hard to imagine anyone being more full of themselves and shit at the same time! #bunkerbabyinchief #trumpdeathtoll113k #black_lives_matter #worstpresidentinhistory,blm
758,1,you have run the biggest voter fraud in history. shut up joe,elections2020
5462,0,"disgusting behavior is a cop murdering an innocent black men with his knee in his neck for 9 minutes, that is what is disgusting. george floyd was a minister.",blm
5041,0,"safe to say, after this, we need to abolish that which used to protect slave owners, and abolish the electoral college. 3/5's claus does not exist anymore... antiquated and horrible",elections2020
8979,0,he did not lie like you joe,elections2020
5344,0,"i do not recall seeing anyone ask kanye his opinion, but good for him for doing something right given his recent streak of assholeness.",blm
989,0,"if arizona turns out red, that fox news decision maker will definitely get fired. #electionnight #elections2020",elections2020
2958,1,"he is ,a murderer !!! he will go down in history, as the #supespreader killing hundreds of the american people , and his #cloroxclan who do not wear mask ! they are all #criminals #pealleadersh#bidenharris :blue_heart::water_wave::blue_heart::water_wave::blue_heart::water_wave:",elections2020
1272,0,#redswarm #trump2020 #maga amy coney barrett to supreme court and (liberals freak out comp),elections2020
735,1,holy shit!! did anonymous antifa do this?!!,blm
5072,0,hate actors who hate presidents with china virus.,covid-19
5584,0,"alert: #turkey will attempt again to push #immigrants at #evros #greek #europe an border. turkey will use #terrorists from #idlib to kill an immigrant and blame #greece, in the wake and opportunistic hope of exploiting #georgefloyd death and current #protest s in the states.",blm
5844,0,"fake news. facts matter. no terrorists, just opportunists taking advantage of the situation. stop lying, stop trying to spread fear. trump lies, americans die 106,000+ americans dead george floyd",blm
3476,1,226 thousand americans are dead because of trump. he has no plan. he is an accused rapist sexist bigot liar cheater racist cheater on all his wives his companies go bankrupt snd the usa is a mess. we need new leadership. vote biden,elections2020
4968,0,2020 trump 2020 trump 2020 trump,elections2020
3708,0,:face_with_tears_of_joy::face_with_tears_of_joy:elon must have put one of falcon 9's merlin engine in his butt:face_with_tears_of_joy::face_with_tears_of_joy:,blm
4898,0,you better get on your knees and pray for all the lies you are telling...,elections2020
2821,1,you all told me that was a set up to lynch black people :expressionless_face:,blm
389,0,i truly do not know how you all can defend cops at this point.,blm
8004,0,then why the hell am i only seeing thousands out on the streets? there should be millions.,blm
9355,0,"road to hell, god save minneapolis...",blm
3433,1,wow.... called the president a clown!? how disrespectful! is the president and you will respect the office! gfy biden... i hope you collapse and expire. :face_with_symbols_on_mouth::face_with_symbols_on_mouth:,elections2020
9009,1,joe biden is a pedophile,elections2020
4746,0,"i have just done my best impression of his dad shouting at anti abortionists, on a racist who has commented on the page re #blacklivesmatter ""read your bible luke 15 vs 4 to 7"" hat tipped to",blm
5930,1,"i am not a conspiracy theorist at all, but i do not think all these people are dying from covid-19",covid-19
5517,0,"but my analysis of minnesota's law lead me to conclude that despite the heinous acts of #derekchauvin & #georgefloyd cries of he cannot breathe, i do not believe derek meant to kill him. i think he wanted to dominate george to show who was boss & hurt him, but not kill.",blm
220,1,you mean the liberals do...because all you all do is cheat. no moral code,elections2020
383,0,look at your employee. i live in nj. fire this monster now!,blm
5820,0,i believe our president should not be a senile puppet who is on the payroll of the ccp. joe biden sold out america to the chinese communist party. he is not worthy of one vote!,elections2020
8071,0,we can blame it on pandemic :face_with_tears_of_joy: it was only a matter of time,covid-19
858,0,here we go again... identify the racist.,blm
8322,0,"mr. president in already working hard for america because covid is killing people everyday everywhere. not for publicities or photo-oops, but this needs to be done immediately. because trump never did his job. trump was never the president of people of the united states.",covid-19
5327,0,white people do not buy tickets to anthony joshuas crap fights #blacklivesmatter,blm
4053,0,jeo biden 2020 from pakistan,elections2020
5533,0,"dictators do stuff like order people around, put government apparatchiks in charge of our lives, and confiscate guns. now... let me think... who wants to do all of those things? hmmm... #dumbass #takethered #votered #maga",elections2020
4031,0,george floyd and rayshard brooks are two completely different situations. floyd was murdered by a dirty cop. brooks initiated a fight and stole a weapon and was a threat.,blm
1392,0,"you all really do not understand the term ""karen"" :face_with_tears_of_joy: this is an actual crime worth reporting",covid-19
2074,0,"ummm, we are in a recession that is driven by an uncontrolled pandemic and our has no fucking plan... really?!?!?",elections2020
4756,0,dox them all anyway.,covid-19
1033,0,"i too need to see a virus kill 230,000 people in my country before i believe it is real",covid-19
10055,0,"when trump asks you to say law and order, say it and then ask him to say that black lives matter. when trump says he is smart, ask him to prove it by releasing his college transcripts or his taxes let us see all your biz acumen",elections2020
3730,0,#trump is trying to pull a #gore on #biden! do not let it happen! #elections2020 #electionresults2020,elections2020
10246,1,"he is not human, he is dismissive, soulless trash.",covid-19
3014,0,#blacklivesmatter the protests were about 1. the death of george floyd 2. an excuse for a protest 3. taking down a few statues. ffs.,blm
111,1,here is another thing ya just cannot make up. your 50 year old son smoking crack and abusing children on video. and yet here we are,elections2020
4420,0,gross. i cannot even watch it. #weneedjustice,blm
3306,0,if you think not saying a few words is comparable to genocide then you have some mad priorities,elections2020
7759,0,"thank you so much for ending covid 19. is my dad in hospital with covid 20? please advise, oh godly one!",elections2020
5720,0,"it might be a joke for you! but, not for real humans! just like the officer who took george floyd’s life, trump and the us terrorist regime are killing and putting a knee on the neck of people demanding justice. #georgefloyd #justiceforgeorgefloyd",blm
1320,0,lol so was mark wahlberg but you do not seem to condemn him for his past. he is actually committed hate crimes. all you need to say is that george floyd did not deserve to die. period. stfu with everything else.,blm
6806,0,got emmmmmm!,blm
8515,0,the most corrupt ag in american history scales new heights via,blm
667,0,hate*,elections2020
5619,0,i like presidents who are not white supremacists.,elections2020
8849,1,i am glad he knocked his ass out. where the covid mask:rolling_on_the_floor_laughing::rolling_on_the_floor_laughing::rolling_on_the_floor_laughing:,covid-19
6489,0,i vow to to do everything i can to removed the traitor-in-chief from office. he is destroying this country & every single thing we stand for. i promise to vote 4 who i fully support. i vow to vote 4 down ballot dems.i vow to stand up & fight until he is gone. #demcast,elections2020
3067,1,"the system is fucked so honestly bring on the riots, burn shit down, evade your taxes, believe that it is butter and get justice for not just george floyd but every person of color victimized by police brutality",blm
2895,0,republican are trying to cheat in arizona,elections2020
5572,0,you are a dirty and corrupt politician! where is hunter?,elections2020
137,1,how stupid do you feel back your legacy is in shambles. the corruption and traitorous deals with chins make you look foolish and prove to anyone awake your administration was not scandal free.,elections2020
7306,0,covid is a lie and no one has it or died from it ...,covid-19
4385,0,our #louisville neighbors. #blacklivesmatter,blm
1728,0,"jimmy kimmel was talking about ""lou dobbs"" as donald trump calls his 'sniffer' 'lou dobbs' see by your self!",elections2020
6492,1,"fuck this guy. is what happens when a salami gets hit with gamma rays from a 4chan comments section. i say again, louder for the ones in the back, fuck this guy. #blacklivesmatter #blmprotest",blm
4381,0,peaceful protest at hyde park legend :raised_fist_medium-dark_skin_tone: #blacklivesmatter #hydeparkprotest,blm
6193,0,"all sc residents will have access to voting by mail :collision:🅑🅞🅞🅜:collision: if i am dreaming, do not wake me up because this is fanfuckungtastic! hey, buckle up because we are coming for you with our votes. do not say we did not warn you. #ticktock",covid-19
9628,0,he lost a tennis ball on his walker,elections2020
4228,0,if you do not like dogs there is something seriously wrong with you i am going to.,elections2020
2961,0,was she lost? looking for the bar? what about social distancing? what about the human shit in the sidewalk in her district? so many questions,blm
7223,1,is jack the boob and zuck the bigot?,elections2020
10374,0,thank you trump! #trumpliesamericansdie #trumpgenocide,covid-19
8822,1,"your such a trained liar! no class, morals, or dignity! typical democrats!",elections2020
3487,1,"stay safe my friends in america. these are dark days but you can get through it. remember, vote, defend our brothers and sisters, protect our brothers and sisters. let your voices be heard and stand up for what is right. fuck trump. #blacklivesmatter",blm
1227,1,it is fucking anarchy bruvvv,blm
8100,0,be ruthless vote!! #judgeemmettsullivan #theresistance #justiceiscoming #trumpterrorists #covididiots #bidenharrislandslide2020,elections2020
2166,0,democrats own this!!!,covid-19
2186,0,"oh, i see. well so that really limits things. ok the only way i see this as not for what i see would be if covid really is nothing more than the common cold weaponized for terrorising. & trump hascstaged a masquerading charade , a war room isolated skiff? ....otherwise",covid-19
1274,0,you go joe. expose her ignorance.,covid-19
5464,0,you are just a demagogue! the united states has refused to enter into all climate agreements signed by other countries. usa and europe developed by destroying the environment. what morals do americans and europeans have to accuse brazil of being negligent? you hypocrites!,elections2020
4537,0,god bless future first lady...:winking_face:,elections2020
985,0,dude this guy is serious? and trump retweeted this?????? please anonymous take them out,blm
7379,0,this is sick. and i am so glad nothing happened to her and they could prove them to be idiots,blm
10404,0,ion know why that anonymous dude scare me that shit are not normal:face_with_tears_of_joy:,blm
8333,0,is this true?? with the undercover cop starting the auto zone fire i do not know what is real anymore...,blm
6567,0,"since the media has proved they have no interest in the corruption of , imagine what an unchecked dictator he would be",elections2020
3344,0,black people : i am not reading all of that is the problem! #blacklivesmatter #blm #blackpower read those laws! start reading all of the lies to get to the truth! #she #blackwomenlivesmatter #blackwomen,blm
10279,0,could it be the demoncrats?,blm
6869,0,"election results notwithstanding, trump stands poised to deliver blows to public health, research. the future of american health care, #covid19 response, and sustained funding for #cancerresearch hangs in the balance —",covid-19
2703,0,please donate generously to pm's covid relief fund and help save lives #pakistanis4pakistanis,covid-19
2368,0,it should but it is not because the democrats and liberal media want to keep it quiet. no protest for him. i thought black lives mattered just not his. total black hypocrisy.,blm
2180,1,you give them an inch they will take a mile. if that little pajama boy had any balls he would have shut those protest down the violence would have happened the police station would not hace burned and we would be in a different place today,blm
2107,0,trigger warning another one!! the man was not even resisting but the freakin' police released the dog!! this is horrible #blacklivesmatter #black_lives_matter,blm
7956,1,"the biggest danger to black people is... ...other fucking black people! it is young feral blacks, most without father figures at home, relentlessly running around london shooting and knifing each other. so stop blaming white people and look closer to home. #blacklivesmatter",blm
2174,0,"wallace is not a good babysitter for the spoiled brat president. as usual, trump agreed to rules and then spent his time breaking them.",elections2020
9133,1,"fucking idiots:skull::rolling_on_the_floor_laughing: this imbecile's role in t #blacklivesmatter bull:pile_of_poo:, is to gather and lead, all t peaceful psychotics (like himself), to create an illusion for t people who are part and who are not part of t movement , to make their fraudulence:money-mouth_face: even stronger:middle_finger: :North_Korea:",blm
8451,0,nooo obama did it,covid-19
1911,0,do not hate the playa hate the gameeee,covid-19
6247,0,"if we are going to be able to play at all and if we want to be able to afford to play, we need a deal between cusa and sun belt for this season. come together on a common agreement for covid testing/regulations and work to schedule regional games reducing travel costs.",covid-19
8019,1,"um the cdc admitted that number is off by over 130,000. but you know you are pushing a bunch of bullshit...as do we the people:middle_finger_medium-light_skin_tone::middle_finger_dark_skin_tone::middle_finger_medium_skin_tone::middle_finger_light_skin_tone::middle_finger:",elections2020
7175,0,i am of the opinion that covid 19 will be in the rear view mirror by late 2021 but what scares the shit out of me is the next bug. these lunatics that caused the covid 19 are not changing the way they do things. we are literally sitting on a powder keg.,covid-19
8069,0,yessir i got my merch go get yours,blm
5949,0,"i am all for equal rights, equality for all ethnic groups & race but when we fight among ourselves the real enemy is laughing at us while they take all our right & freedom right from under our noses divide and rule is the game the government is the name #blacklivesmatter",blm
2247,0,what???????????,elections2020
6899,1,"it is all about dividing the country till the election. they cannot have us talk about biden being a pediphile and soooper corrupt. instead the talk is about.. covid 19, racism, murder hornets...",covid-19
7789,0,black people will get the justice they deserve #blacklivematter #black_lives_matter,blm
8948,0,sign the petition! #justiceforflyod #blacklivesmatter,blm
10062,0,minneapolis council saw the mayor get chumped and realized they are next,blm
2844,0,iwf 2020 updates covid-19 preparations for august event #woodworking #manufacturing #business #management #iwf,covid-19
3341,0,ole joe looks like you are afraid of antifa.,elections2020
3980,1,wednesday derangement of #dopeydon: -wh declares pandemic is over per ivanka -muses biden gets assassinated and then kamala is president -deutsche bank forgave 287m in debt to #trump -gov’t paid 2.5m to trump businesses -#covid19 230k+dead 8.8m+infected #unmaga #humptytrumpty,covid-19
6011,0,together. #blacklivesmatter,blm
2879,1,"yep, cannot mute a guy whose unqualified covid ""specialist"" goes on rt, a known russian agent, and spews bullshit.",covid-19
3739,0,this the same women that made fun of biden for stuttering yeah guess what ill make fun of him too cry baby. #trump2020 #blacklivesmatter scan,blm
10228,0,what a joke! is using their own unproven lies about trump taxes to say is lying! #wethepeople stopped reading that garbage for a reason; it is #fakenews #maga #kag2020 #trump4eva,elections2020
160,0,as you should she made fun of george floyd’s death :(,blm
5871,0,"candace owens: ""i do not support george floyd!"" & here is why! durtty d... via wow",blm
4276,1,drop dead you phucking criminal.,elections2020
2845,1,though you were talking about yourself for a sec here.. ‘anonymous’ writing something like ‘your face looks good for punching’ huh and yet i am covard bitch. i bet you got a lot of that adrenaline after writing that response,blm
4632,1,"white elites have started corrupt black organizations with famous supporters and donating millions $$$ to them, so they infiltrate and appease the #black masses and make them swallow their fate of always being the #slaves! #blacklivesmatter #icantbreath #systemicracism #400years",blm
10416,1,goddamn i hate this piece of shit,blm
4037,0,after watching the debate it reminds me of the turtle and the hare race. for the sake of this country i hope the hate win this time.,elections2020
2062,1,vs. the perv vs. the racist lol,elections2020
6302,1,"first #chinaliedandpeopledied, then they started to crack down on african community in #guangzhou with a lame as reason that they do not trust the figures from africa for #covidー19, people with no travel history to africa in the last 12 months. you guys are just inhuman :woman_facepalming:.",covid-19
743,0,"look at this imbecile calling blm protestors ""terrorist. these are people fighting for basic human rights. activism does not equate to terrorism. help philippines by signing the petition below! #junkterrorbillnow",blm
4542,0,damn powerful.,blm
2099,1,#voteagainsttrump burn that sh*t! :fire::fire::fire::fire::fire:,elections2020
2952,1,this is fucking gross,blm
7795,0,cheater cheater cheater cheater cheater cheater cheater cheater cheater cheater cheater cheater cheater cheater cheater cheater cheater cheater cheater cheater cheater cheater cheater cheater cheater cheater cheater cheater cheater cheater we see you,elections2020
3570,1,only thugs here are the cops that made george floyd a memory,blm
9575,1,ahh ya. now we need some fucking apes to escape into the mist.,covid-19
3525,1,"so you are telling me that this guy needed 7 cops to strap him into that gurney for a broken leg, but the several cops that were around george floyd when he was being murdered could not give his cpr or try to save his life by stepping in?? fuck 12",blm
2590,0,fbi and dhs accuse chinese hackers of targeting you.s. covid-19 research,covid-19
8927,0,would it surprise anyone if scump had one of his bull barr/lewandowski death squads try to disrupt george floyd's peaceful funeral ceremony later today?,blm
4054,1,i did not watch the last 30 mins of the debate. the racial injustice portion was really all i needed to hear. and no do not have my vote because he acknowledged racism is wrong. just cuz his comment not the dumbest do not mean the niggas was talking about actual change,elections2020
7851,0,you all are so blinded the true enemy is our justice system and our government system. but yeah let us divide and focus on hating each other and giving the white man what he wants truly. to divide and conquer. #blacklivesmatter #blacklivesmatter,blm
5940,0,. continues to show just how wrong and horrible at his role he is. will win re - election when all legitimate ballots are counted and the jewish people came out for him at a historic level.,elections2020
4931,0,for those of you in charge of taking down the statues you are all cowards following that sheepishly pack..,blm
6166,0,no peace no justice #blacklivesmatter :raised_fist_dark_skin_tone::raised_fist_medium-dark_skin_tone::raised_fist_medium_skin_tone:,blm
3786,1,"becky, why did you like my tweet i was making fun of you - mike ""magic mike"" scarn",elections2020
6588,0,you are a coward. you could not take people talking bad about you voting for so you folded like a cheap suit. damn:unamused_face: #boycottinghollywood #corruptjoebiden #elections2020 #liberalismisamentaldisorder #pedogate2020 #celebbs,elections2020
6674,0,"if you do not care about the caged children at the border, it is safe to assume, and especially now from the covid rhetoric, that you do not care about children at all.",covid-19
6768,0,trump's downfall!! :red_heart::clown_face: #trumpvsbidenfight #elections2020 #electionnight #uselection2020,elections2020
121,0,"#proudboys are american patriots that support the constitution and believe in family values. the #fakenewsmedia always calls the right racist, but they are the true racists. #standbackstandby slayed last night! #kag",elections2020
7846,0,:pig: smoking a pork butt today :maple_leaf: putting out the fall decor :american_football: football is on this weekend :maple_leaf: the leaves are changing :deer: muzzleloader season is soon :check_mark_button: fall is here. :hundred_points: covid cannot take it away. :hundred_points: the politicians cannot take it away. drink it in folks. beauty is all around.,covid-19
2281,0,"sd has set new records in the number of people hospitalized, new cases, and overall active cases. with a 36% spike in covid hospitalizations in the last week, has the highest per-capita rate of hospitalizations in the us. you suck at social distancing.",covid-19
4166,0,this earpiece too plus a wire on his sleeves! #cheatingjoebiden anyone want to take a stab at telling me what this is.....saw it last night but apparently james woods saw it also....,elections2020
6299,0,"give it up, honey. you cannot even get george floyd’s name right. people who are driving into crowds of peaceful protesters with mace and loaded weapons is looking for trouble. the fact that your child was with you just makes it worse. your pathetic explanations make it worse.",blm
9766,0,"getting fired from my job because every time i go to the bathroom i sing ""free bird"" while washing my hands",covid-19
5308,0,british police is afraid of joggers lmao,blm
9163,0,this has become more than scary. just over 2 hours ago #weatherchannel reported that a 2nd person had died in washington state from the #coronavirus now i get this alert that the true number is 6. also that there are more deaths in other us states!#notfake,covid-19
8827,0,when i see anonymous stan,blm
1735,0,donald trump is the reason for all of the covid deaths not governor como!! trump is such a liar liar!!,covid-19
9963,0,rt to remind those who still will not wear masks to please reconsider. have a safe weekend!,covid-19
8829,0,"what is it about fascists trucks, guns & flags? #maga #terrorists #trump",elections2020
2445,1,"hey kamala, quick question. as a senator running point for china through the biden crime family did you have to suck them off for that position too? -asking for america",elections2020
7000,0,"exactly. i have been saying the same. he is stirring this pot of the horrid and unjust death of george floyd to distract, distract, distract, from his failure. he is protecting his evil ass again. #onehundredthousand",blm
2671,1,"""yeah trump is sooooooooooooo racist!""",blm
9335,1,"hey: you are not a fucking lesbian. do not you dare try to speak for lesbians. there have always been trans lesbians, just as there have always been trans women. we are good over here. take your bigotry someplace else.",blm
4866,1,chicken shit,blm
2092,0,read this story from my colleagues & about recent upticks in coronavirus around the state,covid-19
9099,0,"may not have said he will call to replace or add justices to the scotus but, he did say vote for senators. the senate decides on who becomes a judge and who to remove or whether to add more to the high court.",elections2020
7774,0,"science is not a thing to believe in. science is not a religion, you medieval luddite! it is not a faith to be bandied about and worn on your sleeve to gain social credit with your peers, nor a cudgel to attack apostates and heretics with like a cudgel! god you people...",elections2020
9097,0,"they will never believe it, like trump said he can shoot someone in the middle of fifth avenue and not lose one vote how prophetic! sad",elections2020
4850,0,i am playing dragon quest 11 and even though you all got to work on your audio mixing i am about to fuck wit ya :folded_hands_medium-dark_skin_tone::folded_hands_medium-dark_skin_tone:,blm
8576,0,you see that. i see that. america sees that. trump wins.,elections2020
7764,0,the minneapolis police chief had an obligation to reject negotiations with the minneapolis police union.,blm
