instance_id,offensiveness,cleaned_text,cleaned_domain
2140,0,"actually if you take the picture where our soon to be president biden is with a drone as that is, it would be 4 times wider and greater",elections2020
2141,0,"if the murder of george floyd got you riled up, prepare to get violently sick.",blm
2142,0,"this is a new level of ridiculousness. i stand with mayor and all other mayors that have withstood lawsuits, threats, recall petitions, protests and more all because of their efforts to protect the health of their residents. #covid19 #localgov",covid-19
2143,0,i do not know! he might implode!,covid-19
2144,1,you all this nigga low key one of the goat’s :loudly_crying_face::loudly_crying_face::loudly_crying_face::loudly_crying_face::loudly_crying_face:,covid-19
2145,0,usa dead from covid-19 at 125k murdered by president mustard in the white house with the non response #deadbeatdonny #gopmamawmassacre counting bodies is the trumpanzee action plan. #americanshame,covid-19
2146,0,pleaseeee...i am begging you. these riots are not about george floyd!!! why do you not know this!!!???,blm
2147,0,no way you are serious,elections2020
2148,0,"damn dudes. he is a civil rights lawyer. increased the use of police body cams. tripled the money spent on public housing. banned ""warrior"" training in response to philando’s death. he could just care. i do not know. why say that nobody cares, and then when somebody does you bag on them",blm
2149,0,nope... george floyd and his family were caught in a bold-faced lie defrauding america!!! he...was at his own funeral watching!! these are the photos of the funeral compare the two with the thin mustache the other is a fraud!! ( the twin brother),blm
2150,0,the dutch government: zwarte piet: end the blackface minstrel show in the netherlands! - signez la pétition ! via #blacklivesmatter,blm
2151,0,"from what i have seen today, almost all the agitation and violence was kicked off by ""leftist"" white people. not the protestors. they do not care about black lives. they are just there to break shit. it is their fault the media is reporting this instead of the murder of george floyd.",blm
2152,0,ffs you are insufferable. how about you educate yourself with this and then read some more.,covid-19
2153,0,bloomberg also restored voting privileges for felons. this is what the dem party believes in. disgraceful.,elections2020
2154,0,"the people recording were black aswell, so if they could easily kill george floyd (rip) who was innocent, the could have killed them too",blm
2155,0,if you do not love animals then i do not like you!! he does not love anyone but himself.,elections2020
2156,0,all vote centers are now open in california! my mom and #ivoted for... :United_States: the protector of people with pre-existing conditions :United_States: the defender of our faith & freedoms :United_States: the rememberer of the forgotten ...our beloved and a great red wave! #maga #vote,elections2020
2157,0,if it is ok for us to break international law why should anyone comply with daft covid regulations? utter hypocrisy!,covid-19
2158,1,*for you ignorant mofos in da back :speaking_head:*,blm
2159,0,"how did this many people vote for a guy who cannot form a sentence, that there is proof he used his position to make his family rich, and he is creepy as hell?",elections2020
2160,0,"if you do not understand why people are talking about an elite satanic pedophilia ring, take a look at what form fbi agent ted gunderson exposed in 2003.",elections2020
2161,0,the only way democrats can win. and they know it.,elections2020
2162,1,not to mention you let criminals out quietly without telling the victims families. is this why? so more could destroy #illinois in the masks you required may 1st well after the height of the #coronavirus. you are an idiot and should be removed.,covid-19
2163,0,"""i am not saying we were the ones who killed george floyd. but we have to be the ones who pull that cop off his neck!""",blm
2164,0,right. sorry. did not mean it during work for other things... just not covid-19,covid-19
2165,0,go trump!!! #maga #gotrump2020,elections2020
2166,0,democrats own this!!!,covid-19
2167,0,"the little boy who wanted 2 be a supreme court judge when he grew up had the full weight of the amerikkkan police ""justice"" system on his neck & they extinguished his life on camera for the world to see. yes, #georgefloyd is now on the heavenly supreme court judging this world.:folded_hands_medium-dark_skin_tone:",blm
2168,1,the governor about to start fights. only 25% of occupancy. if that is the case nigga leave the stay at home order. take this lock in until mid may - june and actually throughly address covid-19.,covid-19
2169,0,"look everybody, all we have to do is close our eyes & this monster will go away. :face_with_rolling_eyes:",covid-19
2170,0,"give me a name, he said. white supremacists and the proud boys, he was told. he then said for the proud boys to stand back and stand by. i am not here to change your mind, dude. i am no fool and that are not happening. but i saw it and heard it.",elections2020
2171,0,united!!! #blacklivesmatter,blm
2172,0,russian mayor not ukraine #bidencrimefamily,elections2020
2173,0,"the sex trafficker says we should protect the killer because he is a black man. sorry, but it does not work like that.",blm
2174,0,"wallace is not a good babysitter for the spoiled brat president. as usual, trump agreed to rules and then spent his time breaking them.",elections2020
2175,0,"""this entire thread is so good. and the words """"we should stop doing this woke olympic bullshit to each other"""" belong on a plaque.""",covid-19
2176,1,"""headlines like this piss me the fuck off. this is not """"raising (an) alarm."""" the alarm was raised -months- ago when this homicidal plan to reopen schools was announced. this is the culmination of a raised alarm. we fucking knew and the gop went and forced these deaths anyway.",covid-19
2177,1,no he denounces them everytime he is asked. but you have to keep pushing your false narrative to hide the racist you support .,elections2020
2178,0,update you all: fox news is calling all the protestors thugs on live television... #anonymous can you quite possibly do you are thing :pleading_face::backhand_index_pointing_right_medium-light_skin_tone::backhand_index_pointing_left_medium-light_skin_tone:,blm
2179,0,i could make an insensitive joke here but i will not,covid-19
2180,1,you give them an inch they will take a mile. if that little pajama boy had any balls he would have shut those protest down the violence would have happened the police station would not hace burned and we would be in a different place today,blm
2181,0,"this is a lie, but not for the reasons you might think. the usa does not functionally have a 'middle class' anymore. they have been forced into poverty by twenty years of escalating financial crises, stagnant lower-class wage growth, and monopolization leading to less buying power.",elections2020
2182,0,if pres trump is responsible for all the covid deaths and the democrats have this huge plan to end it but will not say what it is until they win the election does not that make them guilty for the same deaths? #covid19 #maga #election2020,covid-19
2183,0,a stunt!!,covid-19
2184,1,"oh yes, he does, you blithering idiot! lololol",elections2020
2185,0,"#joebiden campaign posting bail for ""white supremacists"" burning cities down via #riots2020 #blacklivesmatter",blm
2186,0,"oh, i see. well so that really limits things. ok the only way i see this as not for what i see would be if covid really is nothing more than the common cold weaponized for terrorising. & trump hascstaged a masquerading charade , a war room isolated skiff? ....otherwise",covid-19
2187,0,"demand justice for james scurlock, killed by omaha racist during george floyd protest",blm
2188,1,how am i making no sense? for the past 3 years people have said is. fascist racist hitler like. well now those same people are calling for him to do a national lockdown and essentially have martial law. how insane does that sound to you? #covid19,covid-19
2189,0,my guy is crying cuz he has lost his job in advance,blm
2190,1,you are trash.,elections2020
2191,1,you are a old fool drop out,elections2020
2192,1,"anonymous literally fucking released all the info you need to know, connecting him to epstein. what more do you fucking want",blm
2193,0,i fockin love penguins brah,covid-19
2194,1,f%*king insanity:double_exclamation_mark:,covid-19
2195,0,"stupid decision to cancel cops, as well as postponing live pd. heads up they make cancel live pd these tv executives do not understand the pc mob do not watch the shows they complain about.",blm
2196,0,and the 2nd highest terror alert,elections2020
2197,0,a reminder i would you do not think #blacklivesmatter then unfollow me.,blm
2198,0,you failed badly on covid-19. not sure how you can act like you did any better.,covid-19
2199,1,"the police begged for him to ""drop the knife"" walter wallace did not do so you must be a racist nazi & racist fascist to not think of what walter wallace should have done differently, as if pulling a knife is just normal.",elections2020
2200,0,"they cursed him, devils cannot pray for devils.",covid-19
2201,1,"""#nyslimes """"all the lies democrats find fit to print."""" ny times absoultely butchers democrats for blocking covid-19 economic stimulus -- then quickly changes their headline via",covid-19
2202,0,they are still humans ??,elections2020
2203,0,think of how focused is vs the ridiculous spewing of words and hate by his opponent,elections2020
2204,0,whatever happened to the women that joe assaulted. i thought you believed them. still working on that?,elections2020
2205,0,a few days until #geminiseason. just watch- the day #gemini season begins will be the the new record low for covid cases #kingshit,covid-19
2206,1,hopefully they find enough votes to get an old creep out of the white house. go michigan!!! #elections2020,elections2020
2207,1,"so, these #blacklivesmatter protest must really be fucking with the zootopia sequel. good!",blm
2208,1,no one in america believes you are up this early in the morning. you are a disgusting pathetic politician very selfish you should know better,elections2020
2209,0,she is a terrorist and she is trolling patriots who know it. what is wrong with minneapolis/st paul area? has it always been this liberal? the rest of state is not that way i know for a fact,blm
2210,1,"they are proud of their cruelty,prejudice,and proud to exploit the gullible,proud to incite violence,proud to be misogynist. they are proud to be superstitious. proud people are dying from covid. proud to be a #deathcultgop",covid-19
2211,0,"""""there is not been a campaign, i think, that has been having to deal with the kind of venom that we are seeing from some in the corporate media,"" sanders said. ""this campaign has been compared to the coronavirus on television.""""",covid-19
2212,1,"remember, the minneapolis murderpig was registered to vote in mn and fl.",blm
2213,0,protesters stood on guard as muslims prayed during a #blacklivesmatter rally in new york,blm
2214,0,is not he just special?!!#racisminamerica #blacklivesmatter :raised_fist:,blm
2215,1,fuck david cameron. fuck theresa may. fuck amber rudd. fuck sajid javid. fuck priti patel. fuck the tories. i wish them every hell #sittinginlimbo #windrushscandal #blacklivesmatter,blm
2216,1,"yes let us compare college sports as important and worthy of sacrificing lives as defeating nazis and protecting western civilization. well said, you stupid horses ass",covid-19
2217,0,they killed 5 blacks to send out a message that #blacklivesmatter good luck defending them. they are the hate.,blm
2218,1,civil war 2 is beginning. these chaz extremists hate america. this has nothing to do with george floyd.,blm
2219,0,how about quit your voting dump. :thinking_face:,elections2020
2220,0,"if we have learned 1 thing about being a minneapolis cop--it is that if 18 prior complaints do not get you fired, you might as well kill someone in the street, in broad daylight. sickening. #blacklivesmatter #minneapolisriot",blm
2221,0,trump supporters left out in the cold to freeze :cold_face:.. that is the real headline! #bidenharris2020 #votebidenharris2020 #votehimout2020 #votehimout #trumpispathetic #trumpisnotwell #trumpisaracist #trumpisanationaldisgrace,elections2020
2222,1,"cheater, lier!",elections2020
2223,0,how does the current coronavirus situation affect the way you make money now? what you were taught about money no longer applies. rsvp on see you at noon [pst] #facebooklive #covid19 #coronavirus #smallbusiness #money #financetips #moneytips,covid-19
2224,1,"yes. that is exactly what we need to do. shit down proper. you know, like lots of other countries did correctly.",covid-19
2225,0,if you have not already it is time to accept the very real reality that chances are the olympics are still going to be happening next summer and the us just will not be allowed to send a delegation of because of how we have handled covid.,covid-19
2226,0,the blm and antifa websites take you to bidens website to donate. is crooked as hell.,elections2020
2227,0,"""we"" legitimately means ""all of us."" both sides of the aisle are getting dangerously willing to commit violence in the name of defeating the other side, and that is terrifying. no matter how you cut it, this next week might be rough.",elections2020
2228,0,president trump informs the press that the seasonal flu is more deadly than covid-19 for children under the age of 18. :U.S._Outlying_Islands:,covid-19
2229,1,"you claim to fight for the constitution, yet you defend the #dumbass who pisses all over it, where does the gop hypocrisy end?",elections2020
2230,0,i cut off my little brother after he laughed about george floyd being murdered. being family means nothing to me; i will not associate with racists,blm
2231,1,the fact that i got covid-19 from my job n they do not want to pay me for the 2 weeks i was out is bullshit!,covid-19
2232,0,"today the whole world is laughing :face_with_tears_of_joy: and feeling sorry :neutral_face: because in this election, either wins of donald trump, half of the country have demonstrated an abhorrent support to an ignorant, dishonest, vulgar liar, with profile of an autocrat that made fool of themselves!",elections2020
2233,1,:rolling_on_the_floor_laughing::rolling_on_the_floor_laughing::rolling_on_the_floor_laughing::rolling_on_the_floor_laughing:saving this tweet so i can make fun of you. haha eat crow!,elections2020
2234,0,"""we cannot seem to fathom that the same knee of oppression that kills in gaza could be the same knee of oppression kills george floyd"" ok talk yo shit hair gel",blm
2235,0,"do they have jobs ? stupid comment considering most of trumps base worked through the pandemic , have a problem with going to protest because we have businesses to run or some where to be it kind of inconveniences our freeloading democrat time with not living off the government",elections2020
2236,1,i did not know that piss poor excuse for the violence psychopaths inside of antifa and blm.,elections2020
2237,1,someone is been fucking pangolins :flushed_face: #pandemicspecial,covid-19
2238,0,while donald says the good thing about covid is i do not have to touch my disgusting followers hands anymore.the guy who got popular from his racist lies and is in fact responsible for all the deaths and unrest just continues to ignore his oath and job while spouting lies + blame.,covid-19
2239,1,the thing is white supremacist are criminals. they are not voting for law and order lol,elections2020
2240,0,this is the 3rd time he is tweeted about this lie.,covid-19
2241,0,waste of air,elections2020
2242,1,"""d-icke head : """"he is not antisemitic. what did he say that is anti-jew?"""" normal person : """"for example, that hitler was part of a secret jewish cabal who run the world."""" d-icke head : """"that is not antisemitic. that is fact."""" #deplatformicke""",covid-19
2243,0,they sleep at night knowing there bank account is full and the lights are on and the heat works they do not give a shit about us,elections2020
2244,0,a crook at work,covid-19
2245,0,let us go,elections2020
2246,0,bone spur/bunker boy has no right to say anything about anyone!!! #tuesdayvibes #blacklivesmatter #trumpsjealousofobama,blm
2247,0,what???????????,elections2020
2248,1,this is bullshit. what the fuck. you cannot treat people this way,blm
2249,0,these hypocrites then tweet about 'black lives matter' change their dp into black and also promote fairness creams. height of hipocracy. dark complexion was always a problem on bollywood anyways. #blacklivesmatter #kareenakapoor #bipashabasu,blm
2250,0,he did,elections2020
2251,1,do i believe the coronavirus is real? yes do i believe it is as serious as it is portrayed? fuck no. do i believe the media is lying? yes do i believe a mask with save you? fuck no,covid-19
2252,0,"fact checking joe biden's lies is ""interrupting"", according to chris wallace. stop interrupting, richard!",elections2020
2253,0,#blacklivesmatter. .i can not breathe!!:broken_heart:,blm
2254,1,the world is shit because of them and all of the people in the government do is bail??,blm
2255,0,black lives matter. black hopes matter. black dreams matter. black fears matter. black futures matter. black businesses matter. black feelings matter. black views matter. black opportunities matter. black votes matter. black thoughts matter. black people matter. #blacklivesmatter,blm
2256,1,i am sorry? this tweet is about his son who served this country. where is your fucking respect?,elections2020
2257,0,silence is complicit. you are the douchebag you have always been. #blacklivesmatter #paumisapos,blm
2258,0,so did they beat him up?,blm
2259,0,a clown?,elections2020
2260,0,ya both wasted the people’s time!,elections2020
2261,0,biden was wired. he cheated and still lost the debate. unreal!,elections2020
2262,1,well no shit. his knee was on the biggest vein carrying blood to the brain. it was pretty fucking obvious.,blm
2263,0,"white people justified unruly protests when it pertained to covid restrictions saying that ""they are not hateful people, they are afraid."" but these protests.....? these are criminals? clearly wearing a mask is a horrible human rights violation, but murder is not.",covid-19
2264,1,"yet another lie exposed. what kind of dumbass does it take to lie about things that are so adult verifiable? a dementia/riddled dumbass. hello, dementia joe.",elections2020
2265,0,after last night the proud boys made a logo with trump slogan.,elections2020
2266,0,trump 2020,covid-19
2267,1,"it is 8:29 a.m. and joe ""clap you stupid bastards"" biden has called ""lid!""",elections2020
2268,0,"ya losing control. law and order my arse!!! even martial law would be a bad idea, army and guns, then civilians with guns. revolution up and coming!!! would not want to be you right now.",blm
2269,0,a fool and his money are soon separated... and then given the covid.,covid-19
2270,0,bruh he was impeached he is one of the worst presidents in terms of follow the rules,elections2020
2271,0,for me it is all about :clapping_hands:aspiration :clapping_hands:,elections2020
2272,0,#burial #pandemic #socialdistancing #coronavirus #hypocrisy #georgefloydmemorial #georgefloyd #protests2020 #riots #policebrutality #blacklivesmatter #wewereliedto #mediahypocrites burying a loved one during a pandemic,blm
2273,1,him having the shit would be hilarious cuz he initially called the shit a hoax lmaoooo,covid-19
2274,0,what a crock of bs. this is the kind of ridiculous garbage that the radical left uses to brainwash the sheep.,elections2020
2275,0,that is crazy.....,blm
2276,0,"this is the ultimate test of""fool me once...""",covid-19
2277,0,"last time i checked racism was the discrimination of ones race( skin color, nationality, religion) #blacklivesmatter is the true racist using the excuse of alleged racism to justify racism of blacks attacking their own people & whites for decades. take cultural responsibility!",blm
2278,0,"thank you thank you! candace owens: ""i do not support george floyd!"" & here is why! via",blm
2279,0,"i hope this is a lie! if not, this some bs",blm
2280,0,we need a commission to investigate it seems he loves to waste the tax payer money. #investigateschiff,covid-19
2281,0,"sd has set new records in the number of people hospitalized, new cases, and overall active cases. with a 36% spike in covid hospitalizations in the last week, has the highest per-capita rate of hospitalizations in the us. you suck at social distancing.",covid-19
2282,0,have yet to hear of someone contracting or dying from covid19 because they attended a trump rally. :thinking_face:,covid-19
2283,0,acab acab!!! black lives matter! sign the petition please,blm
2284,1,your stupidity is staggering.. #maga my ass,elections2020
2285,1,lmfao you all trump supporters are so pathetic,elections2020
2286,1,he is such a bad bitch keeping the faith :blue_heart:,elections2020
2287,1,"i have had it! honestly. fuck kammie and her name pronunciation. she withheld evidence in serious cases. release it when dudes were dead. i hope you all consider this a macro aggro, cuz micro aggression is fucking ridiculous. just be aggressive in you are flippin’ face.",elections2020
2288,0,what does that mean? the democrats want more people to die from covid19 so you look more incompetent than you are? that is really stupid ... considering democrats are just as vulnerable to covid19 as republicans. they are just more cautious.,covid-19
2289,0,"wow - freakin mob scene, are not it?",elections2020
2290,0,town hearth server tests positive for covid-19,covid-19
2291,0,minorities got slammed years ago for saying is #notmypresident.. but where is he at now? :woman_shrugging_medium_skin_tone: he does not want to be our president. #blacklivesmatter,blm
2292,0,why did not you denounce antifa?,elections2020
2293,0,"they took over downtown seattle, just like europeans took over north america. at least the citizens of chaz did not kill people like the europeans did. #tuckercarlsonisaracist #blacklivesmatter #trumpisaracist #nativeamericanlivesmatter",blm
2294,1,for everyone that talked shit about this man when he was at his lowest .... one of the few that went out and actually protested.,blm
2295,0,ohio really loves being racist for the majority. good to know. fl i already knew. only thing good there is wdw and manatees. #elections2020,elections2020
2296,1,shit is smarter,covid-19
2297,0,"this is d song for the season. help you are brother man, stop hating on another brother man. words from n pls help me retweet so d message can be spread across #blackouttuesday #wizkid #annonymous #blacklivesmatter #wearetired abuja to akure majek fashek",blm
2298,0,illegal alien released into you.s. charged with murdering two women in machete attack,elections2020
2299,0,"not watching the debate because i have already chosen biden......no amount of trump bullshit will change my mind. it is a waste i am going to. so i am going to do my nails! i vote biden because on the 200,000+ covid deaths and soldiers who have bounties on their head because of trump!",covid-19
2300,0,"once again, people will find a way to crap on this & it is still absolutely disgusting",blm
2301,0,"which is 100% understandable considering the circumstances . i want justice for not even just george floyd but also for all the other fallen soldiers in this shitty war called life , but we cannot make a difference if we are all dead & these cops showed us way too many times that",blm
2302,1,do these mofo's really believe that they are the only ones that have guns? i wear a red hat too.,elections2020
2303,0,"trump supporters can argue that there is no recorded proof of trump calling military vets ""losers"" and ""suckers."" but there is recorded proof of him downplaying and lying about covid. more than 2,000 military vets have died from covid. #trumpknew",covid-19
2304,0,"o rapture, please come and get these people and leave us with godless science. #exvangelical",covid-19
2305,0,white house blocked c.d.c. from requiring masks on public transportation - the new york times,covid-19
2306,0,already $155 has been donated from the people that have commed me :pleading_face::pleading_face:,blm
2307,0,"this is some nazi shit someone put on my car. notice how it looks exactly the same as this ""antifa"" flyer? lol",blm
2308,0,covid-19 is just like the flu you do not even know what you are talking about,covid-19
2309,0,floyd eulogized at minneapolis memorial in first of 3 events,blm
2310,0,i am so ashamed omg hol g7ash shoo 3am yamilo??!?>{>~€,elections2020
2311,0,wow. we are all going to die.,covid-19
2312,0,democrats are scared :face_screaming_in_fear: and republicans are not.,covid-19
2313,0,this tyrant needs to be stopped. he has us in ruins before covid now wants to finish us off,covid-19
2314,1,trump literally destroyed you.s economy in the span of 5 months,elections2020
2315,1,"no madam you own it, your party is destroying the usa and we all know it, just your uneducated people believe your shit. the rest of us are waiting to see you arrested for treason. please #agbarr send the warrant already.",blm
2316,0,those 20 seconds of silence! #canada #trumpdictatorship #trumpincitesviolence,blm
2317,1,cannot wait to see how minneapolis turns into chicago once they dismantle the police there. can we get any more ignorant people in charge in govt. good luck with that mn.. idiots. jmho the people that live there good luck with that. you will be regretting that real fast,blm
2318,0,"you going to george floyd's funeral for political reasons is, frankly, despicable.",blm
2319,0,"good, india's clearly based.",elections2020
2320,0,i think dhec is fudging the numbers,covid-19
2321,0,and roll in sharia? not!!,blm
2322,1,death to china,covid-19
