instance_id,offensiveness,cleaned_text,cleaned_domain
3021,0,"exactly, screw the rest . he gets the best.",elections2020
3022,1,"you idiot. he was not protesting the flag. he was protesting cops who killed people like george floyd, you arrogant ass.",blm
3023,0,"well, at least was not lying when he said trump was a clown. i will go a little farther and say he is a racist clown. :smirking_face::water_wave::water_wave::United_States: #bidenharris2020",elections2020
3024,0,"why alex? just because there not preaching ""all lives matter"" and there supporting #blacklivesmatter why are you so angry alex? lmk",blm
3025,1,"trump's covid response is slow motion genocide. trump does nothing, 200,000 die, but who dies? more black and brown people, percentage wise. result, fewer black and brown people to vote trump out. as for you trump supporters, he finds you disgusting! #trumpgenocide",covid-19
3026,0,what you get when #hollywood and the come together you get total stupidity. #wiunion #wiright #wipolitics #georgefloyd,blm
3027,0,breaking: top white house aide stephen miller is positive for wuhan coronavirus,covid-19
3028,1,i am thinking i saw a turd fly out of his mouth last night...,elections2020
3029,0,"i like ya cut g,",elections2020
3030,0,"when the world is upside down, the fools start making a lot of sense.",elections2020
3031,0,chumps?.......,elections2020
3032,0,time to terminate your relationship with china and become a patriot. time to love the usa.,covid-19
3033,0,lockdown was supposed to be an introvert’s paradise. it is not. learn to set limits. #mediapsychology,covid-19
3034,1,"this is the stupidest shit i have ever read.. ""i think""",elections2020
3035,0,"""i am a scientist. :cloud_with_lightning_and_rain: :snowflake: :cyclone: i am 100% pro-vaccine. :syringe: except when that #covid19 vaccine comes from the same dangerously dimwitted administration that told americans to """"inject bleach"""" into their bodies... :coffin: :headstone:",covid-19
3036,0,this is what you claim is not real. how insensitive to those who suffered.,elections2020
3037,0,"you and your cronies tried to scare everyone with covid 19, but guess what, it did not work. everyone knows this is about the election. you should be on your knees begging god to forgive you before you die",covid-19
3038,0,"#blacklivesmatter protests are still happening, this fight does not go away after a few days, do not let it disappear!",blm
3039,1,"here is your ""idea"" in action. america knows antifa is murdering trump supporters, assaulting cops, burning buildings, harassing and threatening random people with fealty pledges under threat of violence. antifa is a terrorist organization. disavow now!",elections2020
3040,0,"i do not understand the voters of kentucky. this man has done nothing for them, he has only enriched himself & hurt america. are they that ignorant?",elections2020
3041,0,two disgusting teenagers mocking the violent lynching of george floyd. #tiktok #justiceforgeorgeflyod,blm
3042,0,tenfold importance paused delayed begin chosen disapear standards barer highest quality ethical ties extenuating transparency critical good name cheap is anonymous 247 code beg edge contrast argue drama defend 247 cheap half the class half the attention average,blm
3043,0,it is to late!,covid-19
3044,0,yep that is a rap ! i am staying my ass in this house . this coronavirus is hitting too close to home !,covid-19
3045,0,it was premeditated when george floyd said he could not breathe and he ignored him. it was premeditated whwn george floyd was unresponsive and he still had his knee in his neck.,blm
3046,0,thanks for answering. police are targeting journalists on the streets. we saw it in minneapolis early on and the violence against the media has only accelerated. at what point does the importance of the story outweigh any potential material loss?,blm
3047,1,imagine being this dumb.,elections2020
3048,1,"is it still called democracy when your only options are ""boring as hell"" and ""self centered notorious lying *hole""? #elections2020 #election2020 #electionday2020",elections2020
3049,1,"unarmed blacks killed in abortion clinics every year: 400,000+ unarmed blacks killed by police in 2019: 9 guess which one #blacklivesmatter wants to defund? thinking face",blm
3050,0,while average americans cannot pay their bills because of the bungled covid response,covid-19
3051,0,this is looking awfully similar to what police are doing to journalists in hong kong #media #journalismmatters #freedomofthepress #journalists,blm
3052,1,yes! i support your decision to never debate that dangerous idiot again. can you find a new improved way of getting the message out?,elections2020
3053,0,you are a bold faced liar. you will be uncovered.,elections2020
3054,1,hey nj even can vote in person....murphy is an fn disgrace,elections2020
3055,0,and people ask me and my peers why we hate our city..:face_with_symbols_on_mouth: this is literally why:double_exclamation_mark: we are not having this :man_gesturing_NO_medium-dark_skin_tone: #blacklivesmatter :raised_fist_medium-dark_skin_tone:,blm
3056,0,if you love us black people so much then why were not you at george floyd’s service today? :woman_shrugging_medium_skin_tone:,blm
3057,0,we are not playing! #blacklivesmatter,blm
3063,0,21% of the coronavirus deaths are in the you.s. you.s. is only 4.25% of the worlds population. let that sink in. :microbe::United_States::globe_showing_Americas:,covid-19
3077,1,"""i just realized they are idiots.""",covid-19
3078,1,". host just said the police officer ""may have been in the present at the death of george floyd"". jesus fucking christ #minneapolisprotests",blm
3087,0,ummmm fake news.,elections2020
3093,1,unless #cocainemitch ends up being majority leader again.,elections2020
3094,0,garbage in garbage out.,covid-19
3097,0,"since #leningradlindsey has his lips securely attached to #traitortrump 's a$$, how could he not have #covid ? #lindseyhascovid",covid-19
3101,0,"file away the history of union boss, his political backers and the white supremacists #proudboys the president refuses to denounce when contract time comes.",elections2020
3110,0,"i feel insulted by these ""white leftists"" saying #blacklivesmatter when they are shaming people who do not want to be complicit in this false democracy. white people went to war to protect slavery, but they cannot go to war to protect black lives. history has shown us everytime.",blm
3116,1,congratulations on pissing away any credibility as a news organization you had left,covid-19
3119,0,turn the equipment away from him!,covid-19
3120,0,"our city’s fucking burning, this is not a riot anymore this is a attack. i am all for the justice of george floyd, but it should not ever go down like this.",blm
3130,0,i said the same thing! it is really the only sane response.,elections2020
3131,1,none of those rioters give a shit about george floyd or his family!,blm
3144,1,and 100% of them are dumbocrats. #trumpliesaboutcoronavirus,covid-19
3146,0,the officer has been taken into custody for the murder of george floyd,blm
3150,1,fuck kfix #blacklivesmatter,blm
3151,1,you are a fucking idioti,elections2020
3155,0,i am weeping now. his name is george floyd. god have mercy on my hometown.,blm
3161,1,"you lose, idiot.",elections2020
3167,1,look at this stupid asshole,blm
3175,0,"must read article! :police_car_light::collision::police_car_light::collision: this is the strategy of far right. introduce conspiracy theories to undermine the narrative of people calling for justice, equality and accountability. label them paid anarchists. claim floyd’s death was staged. indoctrination using propaganda.",blm
3178,0,"donald j trump infected the country with covid his cabinet the gop congressional senators his appointed supreme court judge and her children with coronavirus he knew he was infected with the virus and he just did not care""he is the leading because of death in the united states.""",covid-19
3181,0,"ah, yes, must admire the classy behavior of the youth in america.",covid-19
3185,0,what was the reason? #black_lives_matter,blm
3192,0,most #powerful & #beautiful #smile on the #internet #today #bollywoodnepotism #ripsushanthsinghrajput #nepotisminbollywood #blackpink #blacklivesmatter #covid19,blm
3194,1,you love seeing people cry? fucking sadist. it is not democrats or republicans. we are humans.,elections2020
3196,0,what do you think of this video regarding george floyd?,blm
3203,0,"#trumpisunwell #trumpisnotwell and a #trumpisanationaldisgrace for good measure. throwing in a #voteblue2020 for good measure. finally, #blacklivesmatter, still front and center. going to march later today.",blm
3205,0,covid kristi trump she is on him! she is a daily embarrassment to this state!,covid-19
3208,0,even the ones that do not exist?,elections2020
3209,0,crazy...,elections2020
3218,1,look at this fool...#dowfutures,covid-19
3223,0,"president trump refuses to condemn white supremacist. given that, anyone who votes for trump obviously likes having a racial white house we now know with no doubt trumps racial foundation. if you walk with a racist you are one.",elections2020
3225,0,i hate everything.,covid-19
3228,1,i wonder if they keep her gagged with a butt plug gag and let her out to play sometimes to make dumbass comments they think will help?,blm
3229,0,i am afraid of covid-19. it is already killing people like me.,covid-19
3234,1,"and do not tell me how to fucking think. if you unfollow me for supporting george floyd, good. leave my fucking sight. i am tired of being silent. fuck you all again. die.",blm
3263,0,"its a new strain of coronavirus, i swear i cannot tell when people are joking or just ignorant",covid-19
3265,1,"by the way this is one of the most idiotic and disgusting statements i have read from anyone about the coronavirus, so good job?",covid-19
3268,0,republicans plan on fighting for them or are you just being stupid to make yourself feel better?,blm
3278,0,wow!!! that is how we should be!!! i cannot help to think it was kind of like he took the guys cross of burden and carried it for him. :sparkles::heart_suit::sparkles:,blm
3297,0,new goal is 6m signatures please share this around !! #blacklivesmatter,blm
3299,0,"percent testing positive 23% in texas with testing down from 60,000 to 30,000. this is crazy bad, texas what is going on???",covid-19
3301,0,"while the police said #blacklivesmattters, the protester cannot breathe. how ridiculous! #newwestberlin #standwithhongkong",blm
3305,0,please see how is #hkpolice performing. action must be taken to sanction the shameless #hongkong government. #humanrights #magnitskyactnow #georgelloyd #georgefloydmurder #blacklivesmatter #blm,blm
3307,0,here is how coronavirus is impacting life on the northern line,covid-19
3317,0,i still cannot believe covid took kinjaz:man_facepalming_medium-dark_skin_tone:,covid-19
3319,0,"my heart breaks for george floyd and his family. my heart breaks for the unheard voices that have been reaching out for help for so long. my heart breaks for this country, and how cold it has become (and always has been) on issues involving its’ citizens of color. i am so sorry.",blm
3329,1,holy shittttttt,blm
3349,0,"pencil neck says, leaders make decisions for the greater good! would anybody in their right mind take leadership advise from this assclown :man_shrugging: do the letters stfu mean anything to you? #dumbass",covid-19
3352,0,you are just so dumb you do not realise that if the protests were not violent all the focus would have still been on george floyd racism and police abusing power but because of the riots it got all mixed up and this whole issue will die within a month,blm
3353,0,#blacklivesmatter always.,blm
3355,0,"best buy, guitar center, marshalls and urban outfitters — groups of looters broke into several emervyille stores this evening, but the thieves were not part of the main protest in downtown oakland.",blm
3381,1,coronavirus is fucking up my stocks and i am sick of it.,covid-19
3386,0,this is health advocacy.,blm
3394,0,the senate needs to kill it. the house will be responsible for any delays in coronavirus relief due to loading this bill with a wishlist of pork designed to benefit them politically. walking away from fixing this is on them too.,covid-19
3396,0,make the message spread #blacklivesmatter,blm
3402,0,this sounds very bad #florida #coronavirus,covid-19
3406,1,fuck you and your disinformation #hysteria,covid-19
3410,1,"pandering for votes with the ""token"" vp candidate.",elections2020
3412,1,so your voting communism? that is a special kind of stupid,elections2020
3415,0,absolutely heartbreaking what happened to mr floyd... there is no one who thinks this was ok,blm
3421,1,this child predator is being aided by his father apparently thinks child predators are fine people,elections2020
3431,0,it never ends:enraged_face: #trumpisanationaldisgrace,covid-19
3434,0,"this is such a great piece of journalism, important and helpful for other reporters and for average readers. just fantastic by",covid-19
3435,0,i think i have coronavirus the doctors are lying,covid-19
3452,0,"complete wrapup of what happened last night in detroit, when a wave of new people showed up and things got violent:",blm
3456,1,you got destroyed last night bro :rolling_on_the_floor_laughing: stutter stand had no absolute response for trumps remarks.. you got simply destroyed and there is no way your going to be potus,elections2020
3464,0,hire an anonymous troll army to discredit the opppositon like a normal person,blm
3466,0,customers that took misleading covid-19 test at now-closed houston area clinic upset with ‘scheme’,covid-19
3481,0,and this is not about justice for george floyd...,blm
3493,0,why is everyone just standing there? help him,blm
3496,0,"we only have one chance, and that is november 3. god help us.",covid-19
3502,0,"ok and george floyd’s family cannot get a loan and bring him back. so what are you saying? i never said it was right, i explained how it happened. it is going to be hard to see through it all so i will not bother",blm
3505,1,fuck no and fuck trump,elections2020
3515,1,"see stuff like this make me mad because why should white people get more justice in america when us black people the one who made america! i say burn all them white buisness down ! , they did not work for they stuff we did !",blm
3526,1,fuck this asshole:middle_finger_light_skin_tone:,covid-19
3560,0,will not cover this though....,covid-19
3576,0,the unholy alliance of trump and dr. oz,covid-19
3586,0,"pack it in joke, you were awful.",elections2020
3589,0,"i would rather have the racism, wtf is this supposed to do?",blm
3597,1,games??? this is not a fucking game you asshole fucking hijueputa,blm
3599,0,let us protest and march in silence! there is power in silence! silence is one of the greatest arts of conversation! actions speak louder than words! 6/22-6/30 our silence will speak volumes! they have not listening to us thus far! let blm speak for us! #blacklivesmatter,blm
3608,1,"fuck you, fuck the oppression, eat a fat cock. why not help out someone for once you umpa lumpa looking motherfucker. #blacklivesmatter #bunkerbabytrump #gorgefloyd",blm
3613,1,you set this up and you damn well know it! trump blames the 'radical left and antifa' for george floyd protests via,blm
3621,1,you said antifa was an idea. here is your idea you idiot!,elections2020
3628,0,but guess what you all???? trumps going to wiiiiiin!!!!!!!!,elections2020
3641,1,"george floyd was murdered by police. instead of bringing our nation together during this crisis, trump wants to turn the us military on our own people and murder more innocents. he has no conscience, no morals, and no business leading this country.",blm
3644,0,:kissing_face::kissing_face: but nevermind,blm
3647,0,you guys go to jail for breaking covid guidelines over in europe? what the actual hell...,covid-19
3658,1,the key to containing an outbreak from becoming an epidemic that merges into a pandemic is strategic planning that respects evidence. that takes public health competence. america fucked that up when we elected trump. what is the price of believeing bullshit? we will see…jt,covid-19
3678,0,crossing my fingers for you from germany. even though i am not an american.,elections2020
3683,0,watch: opens up to about how she is coping during the #covid19 pandemic,covid-19
3684,0,this is equally as bad as trump's tweets,elections2020
3694,0,please sign this petition:white_heart:,blm
3729,1,what a loser alyssa is:rolling_on_the_floor_laughing: she cannot take the bombardment of truth from patriots so she :pile_of_poo:talks & blocks comments:grinning_face_with_big_eyes:,covid-19
3733,0,attack on kamala harris by bernies press secretary the bottom of the barrel for bernie sanders everyone in our country believes the covid 19 tests should be no cost to everyone! i am ex sanders supporter from 2016 what the fuck happened to bernie? bernie give it up,covid-19
3742,0,falsehoods follow george floyd's death via,blm
3750,0,"#blacklivesmatter sign the petitions and donate if you can! latinos and other minorities, please support these initiatives as well!",blm
3771,0,"not working. trump is not nixon. this is not 1968. nixon was not the incumbent either. trump's stupidity & laziness has already led to the deaths of 106,000 americans from #covid19. as a result almost 42 million people are unemployed and the us economy is in ruins. #lameduckdon",covid-19
3776,0,please sue him into oblivion!,elections2020
3780,0,antifa is not real???? cannot support law enforcement? cannot answer if you will not pack the supreme court? disrespectful to the president! had to have your old wife help you down the stairs! could not control 1 person! how can you control other country representatives?? 47yrs-47mths:United_States:,elections2020
3784,0,london stands in solidarity with #peacefulprotestforgeorgefloyd. tu for sharing. we shall overcome. #londonprotests #peacefulprotest,blm
3790,0,30 years. no appeal. #maga forever.,elections2020
3793,0,george floyd protests could spark coronavirus surge in minnesota,blm
3794,0,that is 6200 new covid cases.,covid-19
3798,0,anon: hold my beer,blm
3799,0,"how many of the over 200,000 covid 19 deaths did their lies contribute to..? check out this video. study shows how fox news lies led americans into crisis via",covid-19
3811,0,"watching home town and the stereotypes are sickening. male as the muscle, female as designer and mexicans as landscapers!? #getwiththetimes #blacklivesmatter",blm
3813,0,#black_lives_matter please take the time to go through this link:,blm
3815,0,"176 black school children laid dead on the streets and another one thousand were bleeding and dying from bullet wounds. in the weeks that followed, over one thousand students/youths were shot and killed randomly. this was the soweto massacre!!! #16june1976 #blacklivesmatter",blm
3823,0,"i was pregnant last halloween, and was sooo excited for this years halloween. :wastebasket: :ghost: fuck you covid. fuck you.",covid-19
3824,0,"biden called president trump a racist, last night. take a look at the real racist in his own words..... #debates2020 #maga #trump2020 #blacksfortrump",elections2020
3830,0,idc what the consequences would be but if some mf shot my dog i would break their legs,blm
3836,1,"fuck your asshole, do your research and you will find many who are conservative extremist have been arrested in these events as well. and if not for the continued racism in this country that infiltrates our govt and justice system..you would not have a need for protest and riots.",elections2020
3838,0,'awfully close to genocide': yale professor blames trump administration for us coronavirus deaths. #trumpliesamericansdie #trumpgenocide #trumphasbloodonhishands #trumpviruscatastrophe #trumpliedpeopledied #resignnowtrump #rage,covid-19
3843,1,this mother f r should die a horrible covid-19 death. in fact better yet if anybody gets covid-29 because of him an…,covid-19
3855,0,sign this petition for george floyd :raised_fist:,blm
3860,0,"it is our system that took the lives of breonna taylor, botham jean, george floyd, and countless others openly and with prejudice. it is our system that callously declares guilty until proven innocent with a gun or a knee.",blm
3861,0,"we are offering the certified corporate wellness specialist from now until july 1st, at 50% off to help professionals like yourself to build your career. get free access to the coronavirus workforce preparedness training with your purchase! learn more at:",covid-19
3873,0,"plus, i would like to point out something about the virginia case. according to the sentence, virginia asked for help but lúgaro did not do anything about it. tmu, that is like being one of the officers who did not stopped derek chauvin from chokeholding george floyd to death.",blm
3874,0,liar. kids transmit virus too.,covid-19
3880,1,"no he has not. farm bankruptcies have risen 23%, you complete moron.",elections2020
3891,0,i cannot believe that leaders around the world are endangering their descendants by remaining silent & watching these terrorists groups to rise in power in nigeria! this is a problem that those with offsprings are leaving for their generations to handle! fix it now:folded_hands:#freebiafra:dove:,blm
3895,0,justice for george floyd's murder via,blm
3897,1,the krassenstein family are all idiots. you are either against them or you are a gullible fool.,elections2020
3901,1,"rana ayub supports looting / riots you do not care about justice or being a decent person, you’re just as bad as the cop that killed george floyd. in fact you are being terrorists! and should be dealt with accordingly.",blm
3907,0,we.are.not. from the instagram of say his name #rayshardbrooks #blacklivesmatter,blm
3908,0,protestors shut down interstate in #atlanta after killing of unarmed black man who was sleeping in his car. video: cnn #rayshardbrooks #blacklivesmatter,blm
3913,0,twitter do you are thing :) #blacklivesmatter #exposingracists :smiling_face_with_hearts::smiling_face_with_hearts::smiling_face_with_hearts:,blm
3915,0,"kid i am saying that a person with a cold or the regular flu can go into the doctor, not get tested and be put down as a covid patient because all of those viruses create the same damn symptoms.",covid-19
3918,0,yessss anonymous coming for white supremacists it is time for them to be scared,blm
3921,1,"the chinese are now moaning about the ban of chinese travel to australia due to coronavirus describing the ban as an ""excuse for racism"" if they do not give a fuck about the fact they could have coronavirus or could spread it to others if they have it and are contagious",covid-19
3922,0,"trump's supporters are glad to show up in any conditions with no complain. he fight for us for 4 years, it is our turn to fight for him.",elections2020
3926,1,"that is been proven time and time again with this fraud, yet people continue to put belief in his insanity. he is the very definition of the con.",covid-19
3939,0,"peace in the middle east!! your party has ruined this country joe. you are a lying dog face pony soldier man, old and washed up. you will lose just like hilary lost. #pathetic",elections2020
3941,0,lower taxes & law & order to name 2...,elections2020
3950,1,you guys are some fucking idiots,covid-19
3951,0,:red_heart: please sign this :red_heart:,blm
3953,0,really shows you that it is all been a bunch of crap.,covid-19
3954,0,"there is also this perspective, in case you had not seen it:",blm
3973,0,plz sign this :cherry_blossom:,blm
3981,0,"sign petitions, donate, keep talking to each other, keep the conversation and peaceful protest going!! #blm #blacklivesmatter",blm
3995,0,"jeffrey sachs yanis ben amor disappointing that once again, is failing to mention the role of #csos and #frontlinehealthworkers in the response. suggest you add #csos to the #covid19 commission!",covid-19
4012,1,sick motherfuckers,blm
4037,0,after watching the debate it reminds me of the turtle and the hare race. for the sake of this country i hope the hate win this time.,elections2020
4038,0,"thank you. encourage your celebrity friends to do the same. when someone has been given much, much will be required in return.",blm
4039,0,a little good news from the houston community.,covid-19
4051,1,i am 6:46 into chappelles new joint and i am already tearing up and that is two minutes less than mr george floyd was crying and calling for his mother. as he was murdered. in front of a crowd. by people we pay! to protect us! fuck them & fuck this system.,blm
4052,0,#blacklivesmatter stand for something or fall for anything.,blm
4060,1,"global warming will kill covid19, you monster!",covid-19
4062,0,donate to these while you are at it. minnesota freedom fund george floyd memorial fund,blm
4066,0,am i supposed to feel sympathy?? ignorance is a choice,covid-19
4082,0,please do what you can #blacklivesmatter #justiceforgeorgefloyd,blm
4083,0,oh you do not have to come on show them to me!,covid-19
4092,1,i see a lot of proud violent screaming leftists and liberals in black face passing racially motivated crime bills. you are not black. biden should be condemning his supporters.,elections2020
4095,1,dear god help us make america sane again please,covid-19
4101,0,what do you think about george floyd’s family getting a folded flag?,blm
4113,1,listen up people the only way to do this is $$$ so dig deep and give whatever you can. we are not as wealthy as the 1% but if you subtract the 40% moron base. we have the numbers to do this but we have to buy it! that is sad but it is the reality right now.,elections2020
4115,0,"does meeting with, and praising, anti - semites qualify as ""empowering jew haters""? that is what your bosses and did.",elections2020
