instance_id,offensiveness,cleaned_text,cleaned_domain
1083,0,ayeeee the rust belt looking blue now huh?,elections2020
1084,1,"mr cronyn you sanctimonious,slithering, slimy, shitbag! you & your ilk treated pres. obama like one of your slaves. #blacklivesmatter #bidenharris2020",blm
1085,0,you do not govern by govern by the constitution which says we are free citizens who should never be locked down and treated like prisoners because scientists do not love freedom!! you are a tyrant & want to inflict tyranny on americans.,elections2020
1086,0,#bunkerboy has the gall to call someone weak. #blacklivesmatter #justiceforgeorgefloyd #protests2020 #riots2020 #covid19 #enoughisenough #racistinchief #pedophile #fakepresident,covid-19
1087,0,"it is that black and white, we have led the world in covid cases per 100,000 and deaths per 100,000 since april...and it is now peaking... that is the horrific part...it is peaking now! after months of leading the world.",covid-19
1088,1,#2 that bill of $4200 was for about 6 hours in a hospital. those fuckers who do not want to wear masks need to ask themselves: how much cash do they have lying around to hand over to a hospital if they get covid. feeling strong because they have got 9/10,covid-19
1089,0,cannot come up with a truthful answer so he calls our president a clown. biden has no moral fiber!,elections2020
1090,0,"the sound bite is out there but the transcript shows that trumps first response is ""sure"" about disavowing. he is disavowed dozens of times.",elections2020
1091,0,"somerville, massachusetts declared systematic racism a public safety emergency today. #blacklivesmatter",blm
1092,0,we win:smiling_face_with_open_hands::OK_hand::flexed_biceps::sparkling_heart: #trump2020 #miga #cyrus_i,elections2020
1093,0,he kept his composure and remained calm and tried to be respectful towards trump......... trump came across as a drooling rabid and aggressive dog! the debate was lost for him of his own doing; because he has no respect for the rules as he agreed upon with the moderator.,elections2020
1094,0,what the heck is going on here ?,blm
1095,1,they took the grandma down at the end are you fucking kidding me,blm
1096,1,and the creepiest shit is that it makes you hard,elections2020
1097,0,what... do you actually believe this? the left wing media is addicted to donald trump.,elections2020
1098,1,you will how to believe in science with stupid mind ?,elections2020
1099,1,"you are incoherent, comrade",elections2020
1100,1,"was a disgrace last night. told numerous lies, refused to say he will not pack the supreme court. why did not chris wallace ask about how he likes to sniff and group little girls.",elections2020
1101,0,great! now even nascar is less racist than our president. #nascar #confederateflag #confederatemonuments #trumpgate #bunkertrump #gopbetrayedamerica #racism #racistinchief #blacklivesmatter,blm
1102,0,late in the midnight hourrrrr :folded_hands_dark_skin_tone::folded_hands_dark_skin_tone::folded_hands_dark_skin_tone::folded_hands_dark_skin_tone::folded_hands_dark_skin_tone::folded_hands_dark_skin_tone:,elections2020
1103,1,f*ck black lives matter,blm
1104,1,"there are a million things i would rather do than attend trump’s magadeth kkk all-white rally.. seriously, these people are so dumb for waiting in line risking covid to hear a clown speak!!",covid-19
1105,0,adolfina villanueva was a black woman who was killed by the police in 1980 for refusing to vacate her property after the catholic church tried to expropriate her land. no one was ever prosecuted.,blm
1106,0,truth #freeslavesforsale #newalbum #juneteenth2020 #mayaangelou #blacklivesmatter #blacktwitter #racistinchief #racisminamerica #slavery #lessonslearned #blackpower #hiphopmusic,blm
1107,1,"must be nice 2 be so ignorant. you do realize that trump’s super spreader cult like gatherings have killed more americans that will now not be able to vote, right?",elections2020
1108,0,"hey twitter! this facebook group is from my hometown, and has lots of racists, and very few people actually standing up to them. do your thing. #blacklivesmatter",blm
1109,1,black twitter please take care of this as soon as possible. this white kid thought it was real cute to joke about h*nging black people. #goodbyescholarships #blacktwitter #blacklivesmatter #kpop,blm
1110,0,george floyd's murder: what northern nigerians must learn from it,blm
1111,1,your mother fucker. amazon belongs to brazil and is not for sale.,elections2020
1112,0,"if you vote for trump and gop - your kids, parents or friends are more likely to die from covid19",elections2020
1113,1,win it!! #f*cktrump,elections2020
1114,0,"you are living under a she will. biden is corrupt along with his democratic friends. trump may not be a character of your liking but he works for the american people and does not take money from wallstreet like biden does, or take money from china for future gains.",elections2020
1115,0,what is the real story? :face_with_raised_eyebrow:#covid_19 #wwg1gwa,covid-19
1116,0,all the horrible things trump hates say about president trump you would never see him do something like this to any woman. a man will not beat on a woman i was once married to a beater. it all stopped one nite when i drew my 357 out of my purse & the coward ran.,blm
1117,0,sickened is such an accurate description. do your homework before you laud these folks as heroes.,blm
1118,0,i am #notbuyingwhatyoureselling. the only motivation to your bs apology is money. you are starting to feel the financial effects of your racism. #boycottcrossfit #blacklivesmatter,blm
1119,0,says the man caught in bed with the chinese communist party and directly responsible for covering up the beginnings of the covid-19 outbreak. he and the ccp have blood on their hand. #whoiscorrupt,covid-19
1120,0,this #notallmen hashtag is very unfortunate and i will-considered. it completely misses the point. it is the same as when we say #blacklivesmatter and then some idiot says all lives matter. very unfortunate!,blm
1121,0,the media is to blame,blm
1122,1,anyone with eyes and ears who votes for is truly deranged. they are so filled with visceral hate for trump that they have turned off their ability to think.,elections2020
1123,0,what the media will not show you. black men guarding from looters. #blacklivesmatter #bluelivesmatter,blm
1124,1,fuuuck this broke my heart. hope wee baldy cunt and his pal never feel an ounce of happiness again,blm
1125,0,"probably! that is the crazy world we live in. lrt’s face it, this is treason! and george floyd was killed for $20.",blm
1126,0,"i am convinced that george soros is manipulating #blacklivesmatter just the way he manipulated the #anc, the #apartheid national party & fw de klerk before, during & after codesa. #youthday #ancmustfall",blm
1127,0,grasping at straws...always. nucking futjobs.,elections2020
1128,0,seems like every day the invents a new way to be an embarrassment!,blm
1129,0,"there was a rabid monkey throwing feces at him while screaming ""socialist"" and ""radical left"" over and over again. calmly pointing out why that has no basis in fact was the right move, and joe accomplished the task. do better.",elections2020
1130,0,"like i have said, 45 does not care about americans and per him, petty lives. oh, he loves your vote, but only tolerates you or me at best.",covid-19
1131,0,another unarmed black man was murdered by police. this has to stop now! #blm #policebrutality #blacklivesmatter #blacktwitter #protests,blm
1132,0,is this guy serious?! how is the coronavirus chinese? is he being blatantly racist on purpose?,covid-19
1133,1,"george floyd did not die peacefully, he died violently and viciously by the hands of ""murdering racist police."" . the government of the you.s. is dismantled, and blithering ignorant; but mostly borderline stupid, the police/courts/government killed mr. george floyd.",blm
1134,0,say his name!!! robert fuller was lynched and no one is talking about it!!!! #justiceforrobertfuller #blacklivesmatter,blm
1135,0,"j i could really spazz an break it down for you but i am about to say this keep digging. you bout to find out some shit that is going to flip ya world. also go over the film of george floyd was he is being killed. look for details an you going to leave that film say ""yo wtf"" i promise you",blm
1136,0,oh! hell no!!!,blm
1137,0,will still support even though he has mishandled & cost the lives of more americans. to be you have to be a racist or support a racist agenda & is killing black & brown citizens exponentially more than white citizens.#votebyoct22,covid-19
1138,0,"reject #normalization! stand up for #palestine and repudiate your support for #israel's #crimesagainsthumanity, #freepalestine stop us taxpayer aid to #israel now. #bds #boycottdivestsanction",elections2020
1139,0,#blacklivesmatter even to aussies.,blm
1140,0,you all wrong:face_with_tears_of_joy::woman_facepalming_light_skin_tone:,covid-19
1141,1,arrest chauvin right fucking now,blm
1142,0,listening - ‘letter to white america’ by #nbawards finalist,blm
1143,1,so the fact that your own acting head of dhs could not answer one question and pretty much confirmed that your administration is completely incompetent when it comes to actually doing their jobs...which is your fault!!! take cover a shit storm is coming!! #covidー19 #trumplies,covid-19
1144,0,i do not know how there is so many morons on earth,elections2020
1145,1,you are disgusting.,elections2020
1146,0,"look around & listen up - johnson might say the uk is not racist, but black britons disagree ""it is a fallacy that it is rife in the us but not here...racism is racism and it is an ongoing problem in the uk"" - nadine white",blm
1147,1,"bojo/tory shit show have achieved world class he crows on about the uk has the world's highest covid-19 death rate, report finds yes bojo is a world class tw.t with absolutely no dought whatsoever",covid-19
1148,1,"omg they bring out the ""magic"" obama like he can save you ????? f%^k no joe !!!!! the trump is rolling and there is no stopping it !!!!",elections2020
1149,0,"i am white, but my future kids will not be, i dred having to have the conversation with them in the future about being extra extra careful about what they do and about dealing with police in the future. please, reform the system. #blacklivesmatter",blm
1150,0,"""what is the point of so-called """"independent"""" inspectors general if they can be fired by a raging, narcissistic criminal clown whenever there is a chance they might actually do their jobs?!",covid-19
1151,0,"welcome to chavs. spitting on and assaulting random people as a mob. honestly, just get rid of them, they serve no real purpose in life, they are just a pain in the ass for everybody that has to ever be around them.",blm
1152,0,why is the janta even counting on thugs. they have no feelings except for themselves. karma awaits bollywood. #cbiprobedishamurder the whole world must boycott india #boycottindia,elections2020
1153,0,. enough is enough! send in the military under the insurrection act and prosecute these criminal protesters! :backhand_index_pointing_down::backhand_index_pointing_down::backhand_index_pointing_down:,blm
1154,0,"wait.... what? a known terrorist organisation has an online presence, encouraging chaos,disruption. and attacks on the west.... ...and it is allowed to? hack this and destroy it now!!!! bbc news - george floyd death: al-qaeda tries to exploit us unrest",blm
1155,1,they screamed about the dangers of coming back to dc to do their job because of coronavirus but suddenly they can all gather in a small enclosed space with no masks for political grandstanding? what a fucking joke,covid-19
1156,0,"george floyd & collins khoza, different sides of the same coin :broken_heart::broken_heart::broken_heart: #justiceforcollinskhoza",blm
1157,0,this is the definition of propaganda. :disappointed_face:,covid-19
1158,0,"joe you think china is your piggy bank and you turn your back on the american people by selling ip, precious metals, cia agent identities, and free reign to the ccp in the south china seas. you will be tried and convicted by all americans sooner or later.",elections2020
1159,0,covid killed glow. 2020 really sucks.,covid-19
1160,1,this is the type of movies i want to see in the upcoming year. i do not want to hear shit about a covid inspired anything!,covid-19
1161,0,covid-19 relief plan (in partnership with & capsule collection face masks now available for sale. visit our online store to buy :T-Rex:,covid-19
1162,0,"is a follower, not a leader. he is a typical politician. that is why it is hard to criticize him. he does all his dealings in the dark, away from the american people, and then turns around and says whatever you want to hear.",elections2020
1163,0,"if those police attorneys think the world is unclear on the videos we have all watched then heaven help them. we are clear. it was murder. judge peter cahill, we are watching what you do. #blacklivesmatter #justiceforgeorgefloyd",blm
1164,1,"that is such a load of bs . the taxpayers had to bail out the farmers because and his entire administration which includes you , is incompetent!",elections2020
1165,0,how organized are these fascist communists? very give a listen to this link. it is only four minutes,blm
1166,0,it is due to the looters who are just plain thieves. terrible people. so for the next five years we all will be paying higher prices. duh!,blm
1167,0,the idea that the presidency is a meritocracy and not a stupid popularity contest is beyond funny. (and he coincidentally cut the irs so they could not perform audits on his buddies). trump’s policies are trash and work about as well as hydroxychloriquine does in fighting covid.,covid-19
1168,1,trump could not get any bitches so he got little girls. #anonymous,blm
1169,0,you forgot the most important ones: 6. ban guns. 7. defund and remove the police. 8. censorship. 9. implement socialism. 10. spread propaganda & misinformation.,elections2020
1170,1,"they are all #zionists: (and ""president"" or (mike pence) (and ""president"" all #zionists",elections2020
1171,0,trump 2020 so no to brives from china & ukraine!!!!!,elections2020
1172,0,nonexistent #antifa. says #antifa is a myth. helped fund springing them from jail when they are arrested. we have all seen what #antifaterrorists are doing to usa. #democrats think we are stupid. #debates #debates2020 #election2020,elections2020
1173,0,i believe in #tonybobulinski you are a corrupt politician and a traitor to the american people.,elections2020
1174,1,"what makes you think the cops are racist, george floyd happened to be black the cop happened to be white. no matter the industry there are going to be some cunts who abuse their power,",blm
1175,1,"""...barr is spewing out lies and moronic stupidity... to shelter the criminal trump regime but especially his führer trump."" not hyperbolic truth 2 say trump family lied their way into wealth. start'g w/trump's grandparents & continu'g unabated w/each generation. #protests2020",blm
1176,0,wow. grifters...,elections2020
1177,0,it saddens me how many of my hospitality friends are losing their jobs. :loudly_crying_face: i hate you #covid19,covid-19
1178,0,"so wait. biden got hammered by ""latinos"" because he is a ""socialist"" and ""bernies puppet"" but bernie. as in the actual bernie would have done better??",elections2020
1179,1,in-freaking-deed ... the wild cards are republican cheating and putin's hordes #vote #voteearly #vote2020 #votebluedowntheballot #bidenharristosaveamerica #vetsresistsquadron #maga #democrats #donotbelievepolls #donotbelievemedia without fact checking... rt,elections2020
1180,1,its national coke a porn day then...,blm
1181,0,#wevotewewin do not get caught up on a web of lies by the trump campaign .,elections2020
1182,0,"i know people are goona think i am racist for this post, i am not. its terrible what happened to george floyd and many other african americans. and the police and military personnel who are tear gassing the peaceful protest are sick",blm
1183,0,""" even the koch appointee...scott gottlieb (aei member) is pushing a watered down version of the koch agenda. """"charles koch network pushed $1 billion cut to cdc, now attacks shelter-in-place policies for harming business""""",covid-19
1184,0,joe will kill jobs and raise taxes,elections2020
1185,0,"i cannot breathe 46-year-old black man; george floyd who died in minneapolis, minnesota after derek chauvin, a white police officer, knelt on his neck for almost nine minutes while floyd was handcuffed face down in the street on may 25, has been laid to rest.",blm
1186,0,if you want to see the epitome of stupidity watch this video. she does not want people with guns in her community killing people. because we all know it is only white police officers that do that.,blm
1187,0,"officer chauvin and george floyd were bouncers at the same restaurant for 17 years!!!! he knew george for 17 years, murdered him, and nothing is being done!!!",blm
1188,0,this mp is inciting criminal damage,blm
1189,0,:face_screaming_in_fear::face_screaming_in_fear::face_screaming_in_fear: call the #meninblack!! hurry!! #jujubushman #natty #conspiracy #theory #covid19 #hideyourkidshideyourwife :rolling_on_the_floor_laughing::rolling_on_the_floor_laughing::rolling_on_the_floor_laughing: #goodvibes #peace,covid-19
1190,0,plus he was a porn star. but do all these things justify him being unlawfully killed by the cops? no!,blm
1191,0,"one of the stupidest arguments i have ever had with someone on facebook was their insistence that rob ford balanced budgets, other mayors did not. i pointed out how that was legally impossible due to this law, but if facts mattered to ford voters, he would not have been mayor.",covid-19
1192,0,every single black person who perished from cop brutality... we should write their names in chalk everywhere... #saytheirnames :raising_hands_medium-light_skin_tone: #blacklivesmatter,blm
1193,0,pathetic politician. phony and weak.,covid-19
1194,1,well it fucking sucks tonya,elections2020
1195,0,he got destroyed,elections2020
1196,1,"the day i support , is the day i announce my retirement! my words are marked. ya see , it works both ways. fuck big coneheaded ass ray!!!!#blacklivesmatter",blm
1197,1,look at this! scum #londonriots #londonprotests,blm
1198,0,freaking white liberals...,blm
1199,1,"if this toady butt kisser of the swamp loser would leave willingly, we might have peace!!",blm
1200,0,it should shock & appall all americans of faith. this was a cheap stunt on holy sacred ground of an historic place of worship. he has no moral corpuscle in his veins. people of faith should repel this vociferously.,blm
1201,0,"trump knows 260,000 words?!",covid-19
1202,1,:police_car_light::police_car_light::police_car_light:oh shit! here we go.,elections2020
1203,0,we are legitimately going to die,covid-19
1204,1,wish covid could catch you,covid-19
1205,0,"what is the minnesota paradox? ""is it possible for things to be so institutionalized, to be so baked in, that good people can perpetuate racial disparities without knowing it?"" #minneapolis #minnesota",blm
1206,0,i urge everybody to watch #sittinginlimbo and then tell us all again that the uk is not racist.....! #windrush #windrushscandal #blacklivesmatter #blacklivesmatteruk #blm,blm
1207,0,i truly loathe mitch mcconnell.,covid-19
1208,0,"sure you can push for what you believe in, but why in the name of george floyd? did not he break into a womans home and rob her at gunpoint, do meth/fentanyl, and did hardcore porn?",blm
1209,1,another rage tweet. damn those voices in his head are not allowing him to think straight. oh yeah #bunkerboy #blacklivesmatter,blm
1210,1,idiots flock together and you two are leading the pack,elections2020
1211,0,thangod,covid-19
1212,0,"home improvement retail is not essential!! i am tired of sick people coming in to stores not taking #coronavirus serious! people this is not the time to catch up on your diy project, stay your ass home!!!! #politics #hotmess #news",covid-19
1213,1,i agree trump is a screaming baby & does not have a plan for our country... let us not forget he did not dismiss his radical racist group in fact he told them to stand by! wth?!!!,elections2020
1214,1,"it is goddam chaos... president death. 140,000 human beings, precious lives lost... in amerikkka....",covid-19
1215,0,you want fascism? come to california for the holidays. #maga #californiafortrump,elections2020
1216,0,"lowered my taxes, 200+judges, peace in middle east, gorsuch, kavanaugh, barrett, no hillary, got rid of racist curriculum. greatest economy in history, highest employment among blacks, hispanics, vaccine in 6 mos.............",elections2020
1217,0,what the hell san diego,blm
1218,1,"resisting arrest has never come with a death penalty in any court of law. so how can you pigs justify a death sentence on the streets. now show me where george floyd was resisting arrest, oh wait you cannot, you just use it as an excuse to kill us. you can fuck right off",blm
1219,0,"just found out about the ""george floyd challenge"" while signing petitions and i honestly feel so sick skjsnksk i hate it here",blm
1220,0,yikes! #blacklivesmatter,blm
1221,1,"the fact that for whatever reason you think me calling a flu that originated in china the chinese virus is racist, is mind boggling. you are undermining real racism and you, you are part of the problem.",elections2020
1222,0,why will not denounce antifa?,elections2020
1223,0,"the brotha was handcuffed, totally defenseless against 4 of them :face_with_symbols_on_mouth::face_with_symbols_on_mouth::face_with_symbols_on_mouth: i mean, jesus, man! i suppose george tried to escape, so chauvin races back around the vehicle to help subdue him. there literally are no words for my anger. george floyd, i am so sorry, bro",blm
1224,1,omg stfu and get a job you dousche. you work for evil clowns,elections2020
1225,0,trump 2020! :United_States::United_States::United_States::United_States::United_States:,elections2020
1226,0,federal judge compares pro-trump robocall scammers to the kkk in furious order,elections2020
1227,1,it is fucking anarchy bruvvv,blm
1228,0,boom. #bidenharris2020 #traitortrump #veteransagainsttrump #trumphatesourmilitary #covid19 #fridaymotivation,covid-19
1229,0,trump does not represent america,elections2020
1230,1,you are delusional! hahah,elections2020
1231,1,"biggest trump sin, & there are many! #covid19 #voteblue #bidenharris2020 #trumpliespeopledie #racisttrump",covid-19
1232,1,this is so fucked up. literally breaks my heart :loudly_crying_face::loudly_crying_face::loudly_crying_face::loudly_crying_face::broken_heart: #icantbreathe,blm
1233,0,"got a horrible feeling, next week's landscape is not going to look like this #dictatortrump #maga #magats #whitesupremacy #gopcorruptionovercountry",elections2020
1234,1,"all i see are a bunch of complicit cowards in the gop that are just fine with almost 200,000 americans who have died from covid. they are fine with pussy grabbing. they are fine with rape. they are fine with him hiding his tax returns. they are fine with the hateful rhetoric",covid-19
1235,0,he has his whole body on this black women. knee in her back and knee in her neck. #andyouwonderwhy #whyweprotest #blacklivesmatter #blackwomenmatter #stopkillingus :face_with_symbols_on_mouth::face_with_symbols_on_mouth::face_with_symbols_on_mouth::face_with_symbols_on_mouth::face_with_symbols_on_mouth::face_with_symbols_on_mouth::face_with_symbols_on_mouth::face_with_symbols_on_mouth::face_with_symbols_on_mouth::face_with_symbols_on_mouth::face_with_symbols_on_mouth::face_with_symbols_on_mouth::face_with_symbols_on_mouth:,blm
1236,1,"he is shamelessly outing himself, so, let us oust him. georgia does not have to be that bitch towing the racist line. it is time to cut the cord on that behavior. #blacklivesmatter #blacklifematters",blm
1237,0,spot on. king nige probably hates the dippers too. void the league,covid-19
1238,1,"this should of never happened! so heartbreaking, so much injustice! #fuckracism #blacklivesmattter",blm
1239,0,he chassd the police with a knife lol,elections2020
1240,0,medical examiner's autopsy reveals george floyd had positive test for coronavirus,covid-19
1241,0,the hypocrisy is suffocating,covid-19
1242,1,"wilma wooten and can both eat a bag of dicks. 15 days to slow the spread 7 months ago, over a virus that 99.9% will recover from if they even get it. let citizens of a free country live their lives and the scared or at risk can hie in their basements like",elections2020
1243,0,"while msm work 24/7 telling you it is covid-19, not the bat soup chinese super wuhan virus, europe is being invaded by sharia loving grooming gangs! :backhand_index_pointing_down:",covid-19
1244,0,"agree, the democratic process should have been followed. i support #blacklivesmatter but mob rule is not the way. dangerous precedent is being set.",blm
1245,0,i love my governor :red_heart: #cuomobriefing #cuomo he has done this shit before!! he gives good information and good ideas .. trump could learn from people if he was willing!,blm
1246,0,does jesus count as ppe?,covid-19
1247,0,"that would be more of a threat if you guys actually voted. people who use the un climate change reports to advance ""solutions"" that ignore the un's chief recommendations are both deceitful and stupid.",elections2020
1248,0,kissing ass again he was totally on biden side never interrupted by he interrupted trump on the time going to make you some more but,elections2020
1249,1,so is jizz so i guess i commit a mass murder every time i cum...,elections2020
