instance_id,offensiveness,cleaned_text,cleaned_domain
1,0,"30 million unemployed , fool",elections2020
2,0,. #wedontbuyhate this is powerful. watch,blm
3,1,"if you watched the entire #georgefloyd porno, you have unlocked your inner level 5 freak & there is no turning back for you...#youknowwhoyouare #dannysdailydose",blm
4,0,stay away from children.,elections2020
5,1,"no super-spreader accusations as people party in the streets from the msm. and just like that, covid ends. the left is a party of liers, racists, cheaters, looters, arsonist, rioters and hypocrites.",covid-19
6,0,trayvon martin #georgezimmerman deserved the death penalty,blm
7,1,trump is in favor of what happened in texas against biden. the republican party as you knew it is gone. anyone who voted for trump can now be considered a domestic terrorist!,elections2020
8,1,that is because he is not and you are the most corrupt and dumbest ever!!:face_with_tears_of_joy::face_with_tears_of_joy:you loser!! #trumpisacoward #trumpiscompromised #trumpisbroke #trumpispathetic #trumpiscorrupt #trumpisnotamerica #trumpisnotwell #trumpisaracist #trumplovesputin,elections2020
9,0,well kind of all over the news. and i do not know how many felons that rob pregnant ladies at gun point get 3 funerals?not really sure.still not getting how they can talk about how what happened to him was absolutely unacceptable w/o misleading people on who he was,blm
10,0,"""you do not want a family christmas if it means people die, do you? do you? you do not want to kill granny. you are not that selfish are you? no. good. thank you for answering our totally objective poll.""",covid-19
11,1,"#blacklivesmatter #blm #blacklivesmatterdc #nokneeling so an employee at just hung up on me for calling about a forgotten drink..a team lead called me ignorant while crying about the 1st employee..and i was given a half ass apology from a mngr ""we will talk to him"" #blm...",blm
12,0,"watch for free, ""america street,"" on racism and murderous violence against black americans, by béninois filmmaker, indrissou mora kpai, shot in the wake of the walter scott murder and the mother emanuel ame church massacre. #georgefloyd #blacklivesmatter",blm
13,0,"it is forced socialism, so... no",elections2020
14,1,"gee. thanks, dick.",covid-19
15,1,"come on man. listen jack , okay here is the deal... you have a hard enough time with the alphabet, let alone run a country:face_blowing_a_kiss::victory_hand:.",elections2020
16,1,who tf is asking these motherfuckers to dance in honor of george floyd? like please!!,blm
17,0,"we are happy to announce that we are now reopen for testing!!! due to covid-19 concerns, we are limiting testing to appointment only and we have added many new procedures to keep you and our clients safe. please call to inquire today!",covid-19
18,0,and their contributors are a cancer on our society. they purposely feed disinformation to their viewers. morally bankrupt and dangerous.,covid-19
19,0,ban anonymous accounts,blm
20,0,covid covid covid covid covid covid covid covid covid covid covid covid you have failed!! just stop the bs!,elections2020
21,0,total confirmed covid cases by county for ut 7-30-20: this and our covid series of visualizations cuts through the noise thanks to usafacts and a top team of data scientists. #covidvislualizations #coviddata #smcanalytics,covid-19
22,0,"not buying what your selling,-#socialismneverworks",elections2020
23,1,fuck you covid 19,covid-19
24,0,"where do people get these ridiculous takes. george floyd was a 6 foot 6 grown man and she is a 17 year old woman. if they are willing to let a man crying for his mother to die they problem would be fine taking out one more person. it is the officers who killed floyd, not her.",blm
25,0,right-wing accelerationists and infiltrators = white supremacists at protests:,blm
26,0,your done! hell no #joebiden2020,elections2020
27,0,"shit got real, real fast.",blm
28,1,"reality. super! #blacklivesmatter is a racist black hate group, soros’ target for manipulation. they are now fully allied with antifa and just as worthy to be designated as a domestic terrorists. who was looting, burning, and murdering in the riots? antifa? blm inspired blacks",blm
29,0,this is what the happens in the brains of people who believe that 5g internet causes covid-19.,covid-19
30,0,"hey bruh, that is not cool. democrats play dirty but we should play smarter. #maga",elections2020
31,1,"i heard the antichrist pontificate from the pulpit using all the six words of his vocabulary, assisted by scores of made-up mumbled & slurred terms. he was ‘biden his time and summoning forth his goons for more dirty work. - thus spake zarathustra",elections2020
32,0,how dare you tweet crap during george floyd’s funeral!,blm
33,1,"george floyd was known as ""mr smile"" and ""gentle giant"" because of his kindness. he always protected women from the bar/resturant he worked at & used to wait with them until their ubers came. fuck the police who killed this precious man. #blacklivesmatters #raisethedegree",blm
34,1,"if people think racism is not alive and well in canada, you are living under a rock! i hope they not only arrested him for mischief but for a hate crime as well. considering it was a blm march, it would be well deserved, asshole! #protests2020 #blmto",blm
35,1,"wait, is this the clown who said that the riots would not stop after the elections? whose husband announced that he was the husband of the next president? who is fooling the east indian people into believing that she is one of them? dumped jamaica now?",elections2020
36,0,"hey #austin store owners need to order new store signs that post ""no shoes, no shirt, no mask- no service"" #atx #austintx cc #covid19 #covid19sweden",covid-19
37,1,"this is not a game moron! you worry more about your stupid hats than 170,000 american lives lost from covid...go away you imbecile...:United_States:",covid-19
38,0,"so you admit that trump was also classless? i would say that failing to condemn white supremacists is pretty classless. yet you pretended not to understand why he failed to do it. brian, just admit it - the president is also a white nationalist.",elections2020
39,1,"for you and your chinese overlords, 操你",elections2020
40,0,this is not even close to true!!!,covid-19
41,0,"as covid-19 continues to impact the nation, learn how works to support florida’s veterans and military families:",covid-19
42,0,his only plan is to steal the wh. he is a one-trick jack,elections2020
43,1,putin's #bunkerbitch #trumpisadomesticterrorist #trumpdeathtoll104k #votebluelikeyourlifedependsonit #blacklivesmatter #enoughisenough:middle_finger::face_blowing_a_kiss:,blm
44,0,this is such a lie. this tweet is egregious. delete it,elections2020
45,0,we lost count of how many white men have killed you george i cannot breathe floyd makes number what?,blm
46,0,"""new covid-19 advisor is a fraud and not an expert! researchers & doctors at stanford's med school say alas is not an expert in diseases. in fact, he """"peddles falsehoods."""" abc news 9/10/20 and business insider, 9/29/20""",covid-19
47,0,good job :winking_face:,covid-19
48,0,dear god.,elections2020
49,0,definitely not punching down,blm
50,0,‘we are moving in the wrong direction’: houston mayor issues dire warning about texas covid-19 explosion - raw story via,covid-19
51,0,"bush was incredibly bad, and both left the economy in shambles. but bush succesfully fought sars covid 1, and implemented the pandemic rapid response team in the wh, trump sent them home. bush was a foe to putin and never got a love letter from north korea. so trump is much worse",covid-19
52,1,"useful idiots podcast: george floyd protests, dems’ failures and the 2020 election with guests marianne williamson and historian dr. gerald horne",blm
53,0,some people talk much but say little,elections2020
54,0,"god bless the usa & pres trump! evil nwo globalist mafia is paying anarchist/thugs to destroy and destabilize america! russia hoax failed, impeachment failed, covid19 falied, now riots, burning, destroying america's cities! this fight is good vs evil!",covid-19
55,0,this is what you all do?! #blacklivesmatter #newyork #nypd,blm
56,0,"just... a question, how can you able to murder someone who has that smile..... i mean... how... what a heartless being....",blm
57,1,i cannot believe my fellow minnesotans are that fling stupid. its always been a dem state but.....biden and heals up harris. good god,elections2020
58,0,"who said rip is muslim abbreviation ... show me ??. itsy a general term use for all religion .... say "" he is allah , (who) is one """,blm
59,1,"my. god. :bullseye: all true. it is utterly unconscionable the cruelty burns through my soul — i will never understand what the gop did to the american people this party should die, just like all their victims of covid #maga morons #vote them all out :police_car_light::police_car_light::police_car_light:",covid-19
60,0,trump golfing this weekend while people die from covid19?,covid-19
61,0,"funny how he calls the protesters ""anarchists"" but not the police officer who murdered george floyd and the other officers who stood over and watched....",blm
62,0,and this big guy will mindlessly drug hoover all the cocaine off malia obama in the west wing kitchen before doing megadeals on china white.,elections2020
63,0,this is nuts. parents do not want their kids tested.,covid-19
64,0,"their word someone shot at them.:thinking_face: kind of like their word they did not murder #georgefloyd, or they ""accidentally killed"" #breannataylor ?",blm
65,0,"nothing said at all. mentioned david dorn last night on fox. very respectful. he was a great man, black & did not get the respect he deserved. off duty & went to help a business being rioted because of the thugs. sad:folded_hands_medium-light_skin_tone::folded_hands_medium-light_skin_tone::folded_hands_medium-light_skin_tone::folded_hands_medium-light_skin_tone:",blm
66,0,looter shot dead by pawn shop owner in george floyd #minneapolis riots midwestern city rocked by anarchy,blm
67,0,"""gop operatives"" :face_with_tears_of_joy:",elections2020
68,1,"with great italian americans like fiorello la guardia in us history, why would anyone want a racist like columbus to be the symbol of a nationality? hell, pick garibaldi who at least supported the anti-slavery movement in the us.",blm
69,1,pennsylvania a racist state. i am every city we are shown by the cops and they do not give a fuck. state regionals too? nah fuck them all. i am from york and a york city cop re-enacted george floyd’s death. sign and get this man off the force.,blm
70,1,do not take the mark of the beast washington disease pedophiles baby eating drinking blood murderers coroner=corona sheeple lead to the slaughter house hoax virus the jesuits are real terrorist,covid-19
71,0,so after doing some research a page called opdeatheaters and youranoncentral are spreading false info people just believe it because there under the name 'anonymous' and think there actually hackers op shared that princess diana was assassinated but that is from a fake news site,blm
72,0,kill coronavirus w kindness,covid-19
73,0,just say you are racist and go you literally have nothing more to say just over and over,elections2020
74,0,no one and i mean no one wants china to own us!! biden sold us out! vote trump to keep americans safe. #trump2020,elections2020
75,0,madness rules this world...,blm
76,0,did he really die of covid-19. ???,covid-19
77,0,the scamwow president,elections2020
78,0,"the fact that a lot of supporters for #blacklivesmatter are from india shows that our society is changing, realising its own mistakes and trying to correct it. so yes your mockery is definitely not doing anything except denying a change that exists in indian society.",blm
79,0,because he has no intelligent thoughts!,covid-19
80,0,why does the union support trump???,elections2020
81,0,no he does not. it is gop propaganda. another reason why we need to vote for,elections2020
82,0,this is why the #blacklivesmatter movement is so freakin important! this is why the protests will only continue to get stronger. this is why the voices will only get louder. this is why we cannot ever stop fighting for black equality!!!,blm
83,0,"right, even if you have to fill them out yourself",elections2020
84,1,truth from trump? hahahaha. man the republicans are getting so stupid.,elections2020
85,0,thousands in australia rally against racism and killing of george floyd,blm
86,0,they are so dirty!!,elections2020
87,1,you are joking right shuffles; covid cases are up as well as covid related deaths you imbecile or do you not recognize the 124k deaths because they make you look bad,covid-19
88,1,told the proud boys to stand by then tells his supports to go into the polls and watch. sounds like a call for intimidation and terrorism. if you are still undecided you are a racist. if your are undecided and say but & you are racist.,elections2020
89,0,"i am not black but i see you, i am not black but i hear you, i am not black but i mourn with you, i am not black but i will fight for you! #blacklivesmatter",blm
90,0,:face_with_tears_of_joy::face_with_tears_of_joy::face_with_tears_of_joy::face_with_tears_of_joy::face_with_tears_of_joy:golden,covid-19
91,0,stupidity abounds in mainstream media!,blm
92,1,our vice bobblehead and criminal gop,elections2020
93,0,"consider how long and what it took—including video of the last 8 minutes and 46 seconds of #georgefloyd’s life and weeks of national and international protest—just to get the #nfl to simply admit: ""we were wrong."" #nflapology #blacklivesmatter #takeaknee #colinkaepernick",blm
94,0,the trump administration is delusional,covid-19
95,0,"oh thank you for recognizing mr prez whenever you ask to show the crowd they always do so! they are awesome, very friendly & they respect & love you too, like all us patriots! at times they have a champion for the unborn children! #maga",elections2020
96,0,remember when #blacklivesmatter did this?,blm
97,0,"for general information about the #coronavirus, we recommend checking out & who do you go to?",covid-19
98,0,why are you even eating that do you want the coronavirus :nauseated_face::woozy_face::woozy_face::woozy_face::woozy_face::woozy_face:,covid-19
99,0,who has advised the gov that federal aid is tied to not wearing masks? mnuchin? pence? that is deliberately endangering people,covid-19
100,1,7 sigma simulation systems.. 7s.. built these cpr dummies..building is now burned down in minneapolis..#georgefloyd #georgefloydhoax,blm
101,0,#india and #colombia are getting ridiculous. #coronavirus #covid19,covid-19
102,0,covid has turned me into a little snitch but i only snitch on the snitches,covid-19
103,1,"dear mrs. biden, stop abusing your husband to death...",elections2020
104,0,"yep. and the cops are *pissed*, too. :thumbs_up:",blm
105,0,"yes, but we cannot support looters who are on the streets!",blm
106,1,the gop chairwoman does not know who the current president is? i am going to blame ronna mcdaniel for the covid crisis. sounds like she is dumb enough to believe that.,covid-19
107,0,trump on covid death toll: 'it is what it is' ⁦,covid-19
108,0,trump is destroying america ....in the midst of the covid19!...at that :hundred_points::hundred_points::hundred_points::hundred_points::hundred_points::hundred_points::hundred_points::hundred_points::hundred_points::hundred_points::hundred_points:,covid-19
109,0,"no justice, no peace #raisethedegree #black_lives_matter",blm
110,0,five democratic governors killed more people from covid than almost everyone else combined!,covid-19
111,1,here is another thing ya just cannot make up. your 50 year old son smoking crack and abusing children on video. and yet here we are,elections2020
112,0,trump has dropped more bombs in three years than obama did in eight.,elections2020
113,0,two viruses. but white blood cells cannot fight off white supremacy.,blm
114,0,smash mouth!,elections2020
115,0,wow. this is real?,elections2020
116,0,my hand is raised. trump is the worst president this country has had to suffer through.,elections2020
117,0,covid 19-poll? you are irrelevant now. shut up,covid-19
118,1,i know it are not shit but anything i can do to help #blacklivesmatter :brown_heart:,blm
119,0,this is disgusting :enraged_face:just like his dad!,covid-19
120,1,everybody hates you covering for pedos twitter. fk'n pieces of :pile_of_poo::pile_of_poo::pile_of_poo:,elections2020
121,0,"#proudboys are american patriots that support the constitution and believe in family values. the #fakenewsmedia always calls the right racist, but they are the true racists. #standbackstandby slayed last night! #kag",elections2020
122,0,uk cell towers torched amid bogus conspiracy theories that link 5g with coronavirus,covid-19
123,1,"anonymous died in 2011 when everyone got snapped up for dossing the banks, whoever was left lurked 4chan. so nazi right wing hackers are part of team blm? use your common sense fuckwit. anyone can make a anonymous video.",blm
124,0,he was a master criminal and that is why he was arrested in the first place. he was suspected of stealing by writing hot checks i have heard. information about his criminal activities is sketchy and are being hidden from the public. i do not know why!,blm
125,0,that is the tea on performative activism :eyes::hot_beverage: also i am pretty sure that black out tuesday got more posts than signatures on individual petitions (which honestly take just as much time if not less than posting the black square),blm
126,0,"""for to be free is not merely to cast off one’s chains, but to live in a way that respects and enhances the freedom of others."" —nelson mandela",blm
127,1,"need i say more? trolling the democrats is by far one of my favorite pastimes, looks like does to! except does it with class and he trolls like an expert! go get them president trump! screw those anti-american dems! they are worthless and total losers! #maga",elections2020
128,1,says the woman who was out in salons after the lockdown started. you all suck but pelosi is hot garbage,covid-19
129,0,you are delusional,elections2020
130,1,fuck all you all. #maskson,covid-19
131,1,"what about the 190,000 that you and your husband have already killed and the thousand more that attended your covid racist rallies? now your giving us tips? no thank you! you and your cheating husband will come nowhere around our families!!",covid-19
132,0,the only thing joe biden can draw are trump supporters!!!,elections2020
133,0,#gfuelenergy: just $20 helps affirm los angeles incarcerated juvenile probation youth through journal writing & organized sports. feel inspired? visit & donate for our fall affirmative flag football program at: #blacklivesmatter #juvenileprobation #ps5,blm
134,0,have you heard this? - ftp (nwa mashup) #blacklivesmatter #commishradio,blm
135,0,the way-,blm
136,0,""" why do not you double your hustle and make up to 10,000$ while staying at home to avoid covid 19 """"ask me how""""""",covid-19
137,1,how stupid do you feel back your legacy is in shambles. the corruption and traitorous deals with chins make you look foolish and prove to anyone awake your administration was not scandal free.,elections2020
138,0,and your a has been.,elections2020
139,0,me: damn this coronavirus is so scary lu: good thing you only drink modelo foo,covid-19
140,0,"for some, white people do not matter understand that",blm
141,0,"free uchicago lectures on racial justice, coronavirus and more available via",covid-19
142,0,"if california tried to secede, we would be blockaded and predator-droned and starved back into line within 2 weeks.",covid-19
143,0,"""this is the federalist's corana parties on steroids. just because the governor said you *can* reopen, does not mean you *should* or *have to"""" reopen. have some fucking common sense, people!",covid-19
144,0,the common flu kills more than covid. you e seized on this opportunity to mislead wa residents. what you are doing and instructing residents to do is a complete scam and per your personal political agenda. #voteinsleeout #resign,covid-19
145,0,"- trump time to ban coats the science is clear!!! biden what is your stand on coats? if you do not win this election biden, when the logic of trump gov't covid science is similar to this sort of logic, your country is ruined my friend. trump is a joke",elections2020
146,0,did trump not hear.... the trump tapes of him admitting lying to the american people about how contagious and deadly coronavirus can be to everyone???????,covid-19
147,1,go. fuck. yourself. you. fucking. stupid. asshole. racist.,blm
148,0,because stone cold said so! #blacklivesmatter,blm
149,0,complete insanity dreamed up by people who live in fantasy world.,blm
150,0,and then continue legislative constipation because the senate is locked by traitors to the people of this country. there is almost half the country who would happily leave their neighbors high and dry without batting an eye.,elections2020
151,0,"the new york times attempts to name coronavirus after trump, fails miserably…again",covid-19
152,1,we are all thinking it. trump gets coronavirus and spreads it through republican ass kissing #coronavirus #fakepresident,covid-19
153,0,"i would say the same to you...you got duped by a manic in the wh. i cannot deal with the lies & misinformation. covid lies and 200,00 people have died. he is not a president.hes a bad business man. who cannot handle crisis that do not affect him personally. he does not care if his base dies.",covid-19
154,0,thank you for destroying usa,elections2020
155,0,when we opened back up just a little the #’s spiked. that should tell you something. stay home. stop spreading this. you are putting me and people like me at a much increased risk. we are not expendable. #covidiots #trumpfailedamerica #bidenharris2020tosaveamerica,covid-19
156,0,"my beloved state of texas, governor abbott, is against the murderous act of mr. george floyd.",blm
157,0,hell yeah! covid are not got nothing on a tough bastard like you.,covid-19
158,0,is that all you have? the racist label?,elections2020
159,1,fuck off racist bitch.,elections2020
160,0,as you should she made fun of george floyd’s death :(,blm
161,0,"crap! stop the bs. he was paid large sums of money & used this as a springboard to later fame & more money which is what he wanted. i watched several b&w minstrel shows with my parents & neither the show nor my parents were racist. fact is, it was simply an early form of bgt.",blm
162,0,look at all those people for trump,elections2020
163,1,your kid fucking sucks at drawing,elections2020
164,0,what the frickity-frack?,blm
165,0,awful,covid-19
166,1,this is happening in new york city #cuomo #cuomohatesjews,covid-19
167,0,if anyone actually believes the elites are following the same guidelines we are are fooling themselves! just like in massachusetts politicians were literally caught having party! #michigan #whitmer #covid19,covid-19
168,0,"it is extremely shameful how quick you are to throw the movement under the bus, claiming that we are ""manipulating"" george floyd’s tragic and unjust death to defend your racist friend. for the first time in history, racists are being forced to face consequences.",blm
169,1,:smiling_face_with_heart-eyes:this is so funny! :face_with_tears_of_joy::rolling_on_the_floor_laughing:watch make a ass/donkey out of himself,elections2020
170,1,sure camel. when he imposed the travel bans the demoslobs called him xenophobic,elections2020
171,0,fuck yes!!!!! :bat: work from home with no pants on continues through december 31st because my state does not know how to wear masks and my work is terrified of flu season!!! covid fucking sucks but wfh is amazing :black_heart: #nopantsdance #hermitlife #wearamask,covid-19
172,0,biden had america's back. he stabbed it.,elections2020
173,0,now #antifa is attacking black police officers for no reason.,blm
174,1,"we are no longer mailing our ballots. hand deliver! hand deliver! hand deliver! do it today, as there are freezing storms on the way and we do not want democrats to get sick! leave the lines for the ignorant bigots how will be in line on election day!",elections2020
175,0,expel the cop unions,blm
176,0,"say their name. darick napper, 2015-11-19 #blacklivesmatter.",blm
177,1,things that make you go :thinking_face::thinking_face::thinking_face::thinking_face::thinking_face::thinking_face: russia? biden? libtards where is your outrage ?!,elections2020
178,0,"why does the government far left, only pick on the blacks, when there are so many other races in america?",blm
179,1,i do not want to go out ever again jesus you all clearly do not give a fuck then want the same people who warned you to feel sorry for you when you or your loved one get covid lmfao,covid-19
180,0,"joe biden & the china communist p,which organised in a strategy to control the usa through dumping & debt,& attacks us with fentanyl with the mexican cartels,the major threat to the usa sign: #maga #laptopfromhell #covid19 #china",elections2020
181,1,they should just call this chapter in the history books the price of white supremacy and have it just be the number of covid-19 deaths.,covid-19
182,1,the kkk racist democrats ride for their white knight kkk dementia joe,elections2020
183,0,l.a. today #blacklivesmatter video:,blm
184,1,"you do not care about american lives. all you cair about is furthering your infiltrator's agenda of sowing division, hatred, & anti-semitism, while cheating, lying, stealing, & spewing hateful rhetoric & propoganda. the american people see right through you, zealot. #oustilhanomar",covid-19
